question,answer,contexts,ground_truth,faithfulness,answer_relevancy,context_precision,context_recall
Quines són les principals causes de l'augment del PIB de Catalunya el 2022 segons l'informe financer?,"L'augment del PIB de Catalunya el 2022, que ha estat del 5,5%, s'atribueix a factors com la recuperació del consum de les llars, l'augment de la inversió en béns d'equipament i construcció, així com un fort increment de les exportacions totals, especialment impulsades pel turisme estranger.","['7\nInforme  fInancer  anual  2022I. Introducció\nEl PIB català ha augmentat un 5,5 % el 2022, dos punts per sobre de la zona \neuro i al mateix ritme que l’economia espanyola. Des del segon trimestre de l’any, \nel PIB supera els nivells prepandèmia. L’entorn econòmic ha estat marcat per \nles polítiques de lluita contra la inflació a escala global, els efectes col·laterals \nde la guerra a Ucraïna i el conteniment de l’economia xinesa per les mesures \nrestrictives contra la pandèmia.'
 'Generalitat\nde Catalunya\nInforme Financer\nAnual 2022'
 'L’economia catalana ha resistit els xocs geopolític i inflacionari sense entrar en \nrecessió i tanca l’any millor del que s’esperava. El patró de creixement de l’eco -\nnomia catalana ha anat de més a menys durant el 2022. L’evolució del PIB s’ha \nalentit el 4t trimestre fins al 0,2 % intertrimestral i el 2,7 % interanual, a causa de \nla inflació (que, tot i moderar-se, continua sent elevada), les fortes pujades dels \ntipus d’interès i la crisi energètica i de subministraments.']","L'augment del PIB de Catalunya el 2022, que ha estat del 5,5%, s'atribueix a factors com la recuperació del consum de les llars, l'augment de la inversió en béns d'equipament i construcció, així com un fort increment de les exportacions totals, especialment impulsades pel turisme estranger.",0.0,0.8628659306773825,0.9999999999666667,1.0
Quins sectors econòmics han tingut una evolució més positiva i quins han patit més durant el 2022?,"Els sectors que han tingut una evolució més positiva són els serveis, especialment el comerç, transport i hostaleria, amb un creixement del 7,9%. En canvi, la indústria ha patit una contracció del 2,0%, i el sector agrari ha experimentat una caiguda del 13,9%.","['però l’afectació de la Covid-19 a determinats sectors de l’economia catalana va \nser més profunda, en un context en el qual la població ha continuat augmentant.\nEl VAB català \nva registrar una \nevolució heterogènia \nper grans sectors \nd’activitat, amb \nun fort impuls de \nles branques dels \nserveisDes de la perspectiva de l’oferta, destaquen el creixement dels serveis (7,9\xa0%) i \nl’evolució positiva de la construcció (4,5\xa0%). En canvi, la indústria mostra una taxa'
 'l’habitatge, si bé la crisi de la Covid-19 va portar a una moderació, el 2022 han \naugmentat un 7,1\xa0% interanual.\nFinalment, el sector agrari presenta una disminució del 13,9\xa0% el 2022, que \ncontrasta amb la dada de l’any anterior, quan va registrar un augment del 0,5\xa0%. \nEls condicionants climàtics i els preus de l’energia i els fertilitzants, més les di -\nnàmiques exportadores (en especial, les dificultats del sector carni), conformen \nun marc molt desfavorable.\nEvolució del VAB per sectors'
 'L’economia catalana ha resistit els xocs geopolític i inflacionari sense entrar en \nrecessió i tanca l’any millor del que s’esperava. El patró de creixement de l’eco -\nnomia catalana ha anat de més a menys durant el 2022. L’evolució del PIB s’ha \nalentit el 4t trimestre fins al 0,2 % intertrimestral i el 2,7 % interanual, a causa de \nla inflació (que, tot i moderar-se, continua sent elevada), les fortes pujades dels \ntipus d’interès i la crisi energètica i de subministraments.']","Els sectors que han tingut una evolució més positiva són els serveis, especialment el comerç, transport i hostaleria, amb un creixement del 7,9%. En canvi, la indústria ha patit una contracció del 2,0%, i el sector agrari ha experimentat una caiguda del 13,9%.",0.6666666666666666,0.8768254798260569,0.9999999999666667,1.0
Quina és la importància del turisme estranger per a l'economia catalana segons l'informe?Com es distribueixen les competències entre l'Estat i la Generalitat de Catalunya segons l'informe financer?,"El turisme estranger ha estat crucial per a l'economia catalana el 2022, amb un total de 14,9 milions de turistes i una despesa de 16.479 milions d'euros, representant el 20,7% del total de turistes estrangers a Espanya.","['I. Introducció  7\nII. Característiques principals de l’economia catalana 8\nIII. La Generalitat de Catalunya: estructura institucional  \ni competències  17\nIV. El finançament de la Generalitat de Catalunya  21\nV. Anàlisi pressupostària  32\nVI. Anàlisi financera i política d’endeutament  41\nApèndix. Sector Públic de la Generalitat de Catalunya* 52Índex'
 'ConstitucióL’ordenació territorial de l’Estat es recull en el títol VIII de la Constitució, d’on \nderiva la distribució de competències entre Estat i comunitats autònomes. Con -\ncretament, les competències de la Generalitat de Catalunya s’enumeren en el \ntítol quart de l’Estatut d’autonomia.\nDiversos tipus de \ncompetènciesEn l’esquema de distribució competencial entre l’Estat i la Generalitat de Cata -\nlunya és possible distingir els nivells de responsabilitat següents:'
 'Generalitat\nde Catalunya\nInforme Financer\nAnual 2022']","El turisme estranger ha estat crucial per a l'economia catalana el 2022, amb un total de 14,9 milions de turistes i una despesa de 16.479 milions d'euros, representant el 20,7% del total de turistes estrangers a Espanya.",0.5,0.8546751777010515,0.3333333333,1.0
Com afecta la capacitat fiscal a la distribució de recursos entre comunitats autònomes?,"Les competències es distribueixen en competències exclusives, compartides i executives, amb la Generalitat exercint un alt nivell d'autonomia en àrees com l'agricultura, cultura, dret civil, i ordenació territorial, entre altres.","['de forma que la posició relativa que ocupa cada comunitat autònoma varia \nrespecte a l’observada en termes de recursos tributaris per habitant. Així, \nl’any 2020, comunitats que tenen una capacitat fiscal superior a la mitjana, \ncom Madrid, les Illes Balears o Catalunya, amb uns índexs del 141, 117 \ni 116,2, respectivament, acaben tenint uns recursos inferiors, amb uns \níndexs del 97,8, 98,5 i 99,7. D’una altra banda, comunitats que tenen'
 'una capacitat fiscal inferior a la mitjana acaben tenint uns recursos força \nper sobre de la mitjana, com Extremadura, que passa d‘un índex del 72,6 \na un 115. També hi ha comunitats que se situen per sota de la mitjana, \ntant en capacitat fiscal com en recursos totals, com és el cas de València, \namb un índex de capacitat fiscal del 94,9 i que acaba amb un índex del \n92,9 després d’aplicar el model de finançament. En canvi, n’hi ha d’altres'
 'cooperació:\n• El fons de competitivitat està destinat a les comunitats autònomes que \ntenen un finançament per càpita inferior a la mitjana o inferior al seu índex \nde capacitat fiscal. Té com a objectiu reduir les diferències en els recursos \nper càpita i incentivar l’autonomia i la capacitat fiscal. Aquest fons es dis -\ntribueix entre les comunitats autònomes beneficiàries –entre les quals es \ntroba Catalunya– segons la seva població ajustada relativa.']","Les competències es distribueixen en competències exclusives, compartides i executives, amb la Generalitat exercint un alt nivell d'autonomia en àrees com l'agricultura, cultura, dret civil, i ordenació territorial, entre altres.",0.5,0.8254538694208527,0.9999999999666667,0.7777777777777778
Quin impacte han tingut les transferències estatals en els ingressos no financers de la Generalitat de Catalunya el 2022?,"La capacitat fiscal determina que les comunitats autònomes amb menor capacitat rebin transferències positives per equilibrar els recursos necessaris per finançar els serveis públics fonamentals, mentre que aquelles amb major capacitat han de fer aportacions a les altres comunitats.","['34\nInforme  fInancer  anual  2022Estructura dels \ningressosEl total d’ingressos no financers liquidats del sector públic administratiu de la Ge -\nneralitat de Catalunya durant l’exercici 2022 ha estat de 31.959\xa0M€, que suposa \nuna reducció del 6,7\xa0%. L’exercici anterior es van ingressar les últimes transferèn -\ncies extraordinàries amb motiu de la COVID19. La liquidació dels ingressos del \nmodel de finançament del 2021 va ser positiva mentre que el 2022 va ser zero.'
 'tària.Autonomia financera Els ingressos de la Generalitat són majoritàriament de caràcter impositiu i és \nespecialment destacable la contribució de l’IRPF i de l’IVA, amb un pes conjunt \nsobre els ingressos no financers d’un 58,7\xa0% l’any 2022.\nL’any 2022 el pes dels ingressos impositius, que inclou tant els tributs cedits \ncom els impostos propis, sobre els recursos no financers totals és del 82,6\xa0%, \nun percentatge superior al de l’any anterior (76,1\xa0%), degut a les transferències'
 'resta afectada al finançament d’actuacions de transició energètica.\nEn el gràfic següent, es presenta la distribució del pressupost liquidat, en què es \ndiferencien els ingressos tributaris de la resta i, dins d’aquests, les transferències, \nque provenen del model de finançament.\nEstructura dels ingressos de la Generalitat de Catalunya pel 2022\n(Pressupost liquidat)\nNo s’inclouen les transferències estatals per al finançament dels ens locals.']","La capacitat fiscal determina que les comunitats autònomes amb menor capacitat rebin transferències positives per equilibrar els recursos necessaris per finançar els serveis públics fonamentals, mentre que aquelles amb major capacitat han de fer aportacions a les altres comunitats.",0.0,0.8361883309716345,0.9999999999666667,0.0
What were Accenture's total revenues and operating margins for the fourth quarter of fiscal 2023?,"Les transferències estatals van tenir un gran impacte el 2021 a causa de la despesa Covid, però el 2022, la seva reducció ha fet que els ingressos no financers tornin a dependre més del model de finançament autonòmic tradicional.","['Accenture Reports Fourth-Quarter and Strong Full-Year Fiscal 2023 Results\n-- For the fourth quarter, revenues are $16.0 billion , an increase of 4% in both U.S. dollars and \nlocal currency; GAAP operating margin is 12.0% , compared to 14.7%  in the fourth quarter of \nfiscal 2022; adjusted1 operating margin is 14.9% , an expansion of 20 basis points --\n-- For full fiscal year, revenues are $64.1 billion , an increase of 4% in U.S. dollars and 8% in'
 'Accenture  expects GAAP operating margin for fiscal 2024  to be in the range of 14.8% to \n15.0%, an expansion of 110 to 130 basis points from fiscal 2023, and adjusted operating \nmargin, which excludes an estimated $450 million for business optimization costs, to be in the \nrange of 15.5% to 15.7%, an expansion of 10 to 30 basis points from fiscal 2023 .\nThe company expects both its GAAP and adjusted annual effective tax rate, which excludes the'
 'diluted EPS of $11.41 to $11.76, a 6% to 9% increase; and adjusted EPS of $11.97 to $12.32, a \n3% to 6% increase --  \nNEW YORK; September 28, 2023  — Accenture (NYSE: ACN) reported financial results for the \nfourth quarter and full fiscal year ended August 31, 2023 . \nFor the fourth quarter , revenues were $16.0 billion , an increase of 4% in both U.S. dollars and \nlocal currency compared with the fourth quarter of fiscal 2022 . GAAP operating income was']","Les transferències estatals van tenir un gran impacte el 2021 a causa de la despesa Covid, però el 2022, la seva reducció ha fet que els ingressos no financers tornin a dependre més del model de finançament autonòmic tradicional.",0.0,0.7725336228385512,0.8333333332916666,0.75
"What were the new bookings for Accenture in the fourth quarter of fiscal 2023, and how did they compare to the previous year?","Accenture's total revenues for the fourth quarter of fiscal 2023 were $16.0 billion, with a GAAP operating margin of 12.0%. The adjusted operating margin was 14.9%.","['fourth quarter of fiscal 2022 . Operating cash flow was $3.41 billion  and free cash flow was \n$3.23 billion . New bookings were $16.6 billion . \nFor the full fiscal year , revenues were $64.1 billion , an increase of 4% in U.S. dollars and 8% in \nlocal currency compared with fiscal 2022 . GAAP operating income was $8.81 billion , compared \nto $9.37 billion  in fiscal 2022 , and operating margin was 13.7%  compared to 15.2%  in fiscal'
 'Days services outstanding, or DSOs, were 42 days at August 31, 2023 , compared with 43 days \nat August 31, 2022 . \nAccenture’s total cash balance at August 31, 2023  was $9.0 billion , compared with $7.9 billion  at \nAugust 31, 2022 .\nNew Bookings\nNew bookings for the fourth quarter of fiscal 2023  were $16.6 billion , a decrease of 10% in both \nU.S. dollars and local currency from the fourth quarter of fiscal 2023 .  \n•Consulting new bookings were $8.5 billion , or 51% of total new bookings.'
 '-- New bookings are $16.6 billion  for the quarter and $72.2 billion  for the full-year, a 1% increase \nin U.S. dollars and 5% increase in local currency over full-year fiscal 2022  new bookings --\n-- 15% increase in quarterly dividend to $1.29  per share; Board of Directors approves \n$4.0 billion  of additional share repurchase authority --  \n-- For fiscal year 2024, Accenture expects revenue growth of 2% to 5% in local currency; GAAP']","Accenture's total revenues for the fourth quarter of fiscal 2023 were $16.0 billion, with a GAAP operating margin of 12.0%. The adjusted operating margin was 14.9%.",0.6666666666666666,0.9057330025288141,0.49999999995,0.5
What revenue trends were observed in Accenture's key geographic markets during the fourth quarter of fiscal 2023?,"New bookings for Accenture in the fourth quarter of fiscal 2023 were $16.6 billion, a decrease of 10% compared to the previous year.","['Accenture Reports Fourth-Quarter and Strong Full-Year Fiscal 2023 Results\n-- For the fourth quarter, revenues are $16.0 billion , an increase of 4% in both U.S. dollars and \nlocal currency; GAAP operating margin is 12.0% , compared to 14.7%  in the fourth quarter of \nfiscal 2022; adjusted1 operating margin is 14.9% , an expansion of 20 basis points --\n-- For full fiscal year, revenues are $64.1 billion , an increase of 4% in U.S. dollars and 8% in'
 'to $16.45 billion, or -2% to 2% in local currency, reflecting the company’s assumption of a \npositive 2.5% foreign-exchange impact compared with the first quarter of fiscal 2023 .\nFiscal Year 2024\n \nAccenture’s business outlook for the full 2024 fiscal year assumes that the foreign-exchange \nimpact on its results in U.S. dollars will be flat compared with fiscal 2023 . For fiscal 2024 , the \ncompany expects revenue growth to be in the range of 2% to 5% in local currency.'
 '•Managed Services new bookings were $8.2 billion , or 49% of total new bookings . \nRevenues by Geographic Market \nRevenues by geographic market were as follows: \n•North America: $7.55 billion , flat in U.S. dollars and an increase of 1% in local currency \ncompared with the fourth quarter of fiscal 2022 . \n•Europe: $5.30 billion , an increase of 10% in U.S. dollars and 7% in local currency \ncompared with the fourth quarter of fiscal 2022 .']","New bookings for Accenture in the fourth quarter of fiscal 2023 were $16.6 billion, a decrease of 10% compared to the previous year.",0.0,0.8965458491124877,0.8333333332916666,0.875
"What changes occurred in NTT Data's total assets and equity between March 31, 2024, and June 30, 2024?","During the fourth quarter of fiscal 2023, revenues in North America remained flat in U.S. dollars but increased by 1% in local currency, while Europe saw a 10% increase in U.S. dollars and 7% in local currency, and Growth Markets experienced a 1% increase in U.S. dollars and 6% in local currency.","['March 31, 2024 29,604,223 10,893,059 9,844,160 33.3% 117.08 (yen)\nAnnual Dividends\nEnd of the  first quarter End of the  second quarter End of the  third quarter Year-end Total\nYear Ended  March 31, 2024 － 2.50 (yen) － 2.60 (yen) 5.10 (yen)\nYear Ending  March 31, 2025 －\nYear Ending  March 31, 2025\n(Forecasts)2.60 (yen) － 2.60 (yen) 5.20 (yen)\n(Millions of yen, except  per share amount )\nOperating Revenues Operating Profit Profit before  Taxes Profit  Attributable to  NTTBasic Earnings per Share'
 'Millions of yen\nNTT Shareholders’ Equity\nNon-\ncontrolling  \ninterestsTotal equityCommon  \nstockAdditional \npaid-in  \ncapitalRetained  \nearningsTreasury \nstockOther equity  \ncomponentsTotal\nMarch 31, 2024 ¥937,950 ¥－¥9,078,084 ¥(937,291) ¥765,417 ¥9,844,160 ¥1,048,899 ¥10,893,059\nComprehensive  income\nProfit － － 274,136 － － 274,136 14,645 288,781\nOther comprehensive  \nincome－ － － － 77,570 77,570 37,796 115,366\nTotal  comprehensive \nincome－ － 274,136 － 77,570 351,706 52,441 404,147'
 ""to NTTDiluted Earnings\nper Share\nAttributable  to NTT\nThree months ended  June 30, 2024 3.26 (yen) －(yen)\nThree months ended  June 30, 2023 4.41 (yen) －(yen)\n(2) Consolidated Financial  Position (Millions of yen, except  equity  ratio and per share amounts)\nTotal AssetsTotal  Equity\n(Net Assets)Shareholders'\nEquityEquity  Ratio\n(Ratio of Shareholders'  \nEquity to Total  Assets)Shareholders'\nEquity  per Share\nJune 30, 2024 29,989,405 11,068,578 9,968,123 33.2% 118.55 (yen)""]","During the fourth quarter of fiscal 2023, revenues in North America remained flat in U.S. dollars but increased by 1% in local currency, while Europe saw a 10% increase in U.S. dollars and 7% in local currency, and Growth Markets experienced a 1% increase in U.S. dollars and 6% in local currency.",0.0,0.8253157723530483,0.0,0.0
"How did NTT Data's consolidated financial results for the fiscal year ending March 31, 2025, compare to the previous fiscal year?","Between March 31, 2024, and June 30, 2024, NTT Data's total assets increased from ¥29,604,223 million to ¥29,989,405 million, while total equity rose from ¥10,893,059 million to ¥11,068,578 million.","['3.  Consolidated  Financial  Results Forecasts for the Fiscal Year  Ending  March  31, 2025 (April 1, 2024 - March 31, 2025)\nNotes: 1. Percentages  above represent  changes from the previous fiscal  year.\n\u3000\u3000\u30002. Revision to the  consolidated  financial  results forecasts from the latest  announcement:  None- 1 -'
 'March 31, 2024 29,604,223 10,893,059 9,844,160 33.3% 117.08 (yen)\nAnnual Dividends\nEnd of the  first quarter End of the  second quarter End of the  third quarter Year-end Total\nYear Ended  March 31, 2024 － 2.50 (yen) － 2.60 (yen) 5.10 (yen)\nYear Ending  March 31, 2025 －\nYear Ending  March 31, 2025\n(Forecasts)2.60 (yen) － 2.60 (yen) 5.20 (yen)\n(Millions of yen, except  per share amount )\nOperating Revenues Operating Profit Profit before  Taxes Profit  Attributable to  NTTBasic Earnings per Share'
 'Attributable  to NTT\nYear Ending\nMarch  31, 202513,460,000 0.6% 1,810,000 (5.9)% 1,720,000 (13.2)% 1,100,000 (14.0)% 13.00 (yen)1.  Consolidated Financial Results for the Three Months Ended June 30, 2024 (April 1, 2024 - June 30, 2024)\nAmounts are rounded  to the nearest  million yen.\nNotes:  1. Comprehensive income  (loss) attributable  to NTT:   For  the three months ended  June 30, 2024:  351,706 million  yen (41.2)%\n  For the three months  ended June 30, 2023:  597,851 million  yen 32.2%']","Between March 31, 2024, and June 30, 2024, NTT Data's total assets increased from ¥29,604,223 million to ¥29,989,405 million, while total equity rose from ¥10,893,059 million to ¥11,068,578 million.",0.0,0.8947714591407566,0.9999999999,0.0
"What were the trends in NTT Data's cash flows from operating, investing, and financing activities during the three months ended June 30, 2024?","NTT Data's consolidated financial results forecast for the fiscal year ending March 31, 2025, includes expected operating revenues of ¥13,460,000 million, a 0.6% increase, and a profit attributable to NTT of ¥1,100,000 million, a 14.0% decrease compared to the previous fiscal year.","['net ” in the consolidated  statement  of cash flows for the three  months ended June 30, 2023 has been reclassified  and presented  as\n       ¥20,878 million  of “Proceeds from  sale of property, plant  and equipment,  intangible  assets and investment  property,” ¥167 million\n       of “Proceeds  from acquisition  of subsidiaries” and ¥(3,733) million  of “Other, net.- 11 -'
 'subsidiaries, ” which had previously been  presented within “Other,  net” in cash  flows  from  investing activities  for the three  months\n       ended  June 30, 2023, are now presented separately  for the three  months ended June 30, 2024 due to an  increase in the  materiality\n       of the  amount of such items.  As a result  of this change, the  ¥17,312 million amount  that had  previously been presented  as “Other,'
 'Millions of yen\nThree  Months  Ended  \nJune 30, 2023Three  Months  Ended \nJune 30, 2024Increase\n(Decrease)\nCash flows from financing activities\nNet increase  (decrease) in short-term  borrowings 685,931 676,086 (9,845)\nProceeds from increases  in long-term borrowings 3,130 334,189 331,059\nRepayment  of long-term borrowings (98,684) (207,306) (108,622)\nRepayment  of lease liabilities (63,215) (73,185) (9,970)\nPayments for acquisition  of interests in  subsidiaries from']","NTT Data's consolidated financial results forecast for the fiscal year ending March 31, 2025, includes expected operating revenues of ¥13,460,000 million, a 0.6% increase, and a profit attributable to NTT of ¥1,100,000 million, a 14.0% decrease compared to the previous fiscal year.",0.0,0.8955709680087535,0.0,0.25
¿Cuáles son los principales retos estructurales que enfrenta la economía española según el informe del Banco de España?,"During the three months ended June 30, 2024, NTT Data's cash flows from operating activities decreased by ¥145,742 million compared to the previous year, while cash used in investing activities increased by ¥135,046 million, and cash provided by financing activities increased by ¥193,981 million.","['DIRECCIÓN GENERAL DE ECONOMÍA Y ESTADÍSTICA –BANCO DE ESPAÑA1.Mensajes principales\n2.Dinámicas recientes de la actividad económica en España\n3.Retos estructurales de la economía españolaÍNDICE DE ESTA PRESENTACIÓN\n3'
 'DIRECCIÓN GENERAL DE ECONOMÍA Y ESTADÍSTICA –BANCO DE ESPAÑA 2Capítulo 1\nCapítulo 2\nCapítulo 3\nCapítulo 4 Laresiliencia delaeconomía española enelcontexto europeo\nRetos estructurales delaeconomía española\nElmercado detrabajo español :situación actual, tendencias estructurales ypolíticas deempleo\nElmercado delavivienda enEspaña :evolución reciente, riesgos yproblemas deaccesibilidadINFORME ANUAL 2023 DEL BANCO DE ESPAÑA'
 'DIRECCIÓN GENERAL DE ECONOMÍA Y ESTADÍSTICA –BANCO DE ESPAÑA 6RETOS ESTRUCTURALES DE LA ECONOMÍA ESPAÑOLA\nTamaño y \ndemografía \nempresarial\nCuentas \npúblicas\nProductividadInversión en \ncapital e \ninnovaciónDesempleo \nestructural\n(Capítulo 3 IA 2023)\nEnvejecimiento \npoblacional\nCapital \nhumanoDesigualdad y \nbolsas de \nvulnerabilidad en \nlos hogaresMercado de \nvivienda\n(Capítulo 4 IA 2023)\nMarco \ninstitucionalTransición \necológica']","During the three months ended June 30, 2024, NTT Data's cash flows from operating activities decreased by ¥145,742 million compared to the previous year, while cash used in investing activities increased by ¥135,046 million, and cash provided by financing activities increased by ¥193,981 million.",0.0,0.7279719084516841,0.0,0.375
¿Cómo se ha comportado la inflación en España durante 2023 y cuáles son las perspectivas para los próximos años?,"Los principales retos estructurales que enfrenta la economía española incluyen impulsar el crecimiento de la productividad, reducir la elevada tasa de paro estructural, incrementar el tamaño empresarial, mejorar la calidad y confianza en las instituciones, reforzar la sostenibilidad de las cuentas públicas, y afrontar los desafíos del envejecimiento poblacional y la transición ecológica.","['IPC AÑO ANTERIOR (c)SIN CAMBIOS LEGISLATIVOS\nDESDE 2019/2023Indexando \ndesde 2019Indexando \ndesde 2023Sin cambios desde 2023\nSin cambios desde 2019EVOLUCIÓN OBSERVADA Y SIMULADA \nDE LA RATIO DE IRPF SOBRE PIB'
 '+0,4 2,5-0,5REVISIÓN RESPECTO A LAS PROYECCIONES \nMACROECONÓMICAS DEL BANCO DE ESPAÑA \nDE MARZO DE 2023 (b)'
 'I. Durante 2023, la economía global se ha mostrado relativamente resiliente pero ha sufrido una elevada \nincertidumbre. El contexto internacional ha venido marcado por las decisiones de política monetaria \npara hacer frente a la inflación y por la evolución de un convulso escenario geopolítico. Los precios \ninternacionales de referencia para buena parte de los productos energéticos se han reducido de']","Los principales retos estructurales que enfrenta la economía española incluyen impulsar el crecimiento de la productividad, reducir la elevada tasa de paro estructural, incrementar el tamaño empresarial, mejorar la calidad y confianza en las instituciones, reforzar la sostenibilidad de las cuentas públicas, y afrontar los desafíos del envejecimiento poblacional y la transición ecológica.",0.0,0.8081450956280274,0.0,0.3333333333333333
¿Cómo se describe el proceso de envejecimiento poblacional en España y cuáles son sus implicaciones económicas?,"Durante 2023, la inflación en España continuó una moderación más intensa de lo esperado, impulsada principalmente por una evolución favorable de los precios de la energía. Se prevé que la inflación siga desacelerándose gradualmente en los próximos trimestres.","['DIRECCIÓN GENERAL DE ECONOMÍA Y ESTADÍSTICA –BANCO DE ESPAÑA 12RETOS ESTRUCTURALES DE LA ECONOMÍA ESPAÑOLA\nENVEJECIMIENTO POBLACIONALDinámicas \ndemográficas•Alolargo delasúltimas décadas, lasdinámicas demográficas enEspaña sehancaracterizado porunacaída significativa tanto delatasa\ndefecundidad como delatasa demortalidad \uf0aeconsiderable proceso deenvejecimiento poblacional ...\n•...queseintensificará enlaspróximas décadas yqueserá más acusado queeldeotros países denuestro entorno [Entre 2023 y2053 ,latasa de'
 'DIRECCIÓN GENERAL DE ECONOMÍA Y ESTADÍSTICA –BANCO DE ESPAÑA 30EL PROCESO DE ENVEJECIMIENTO DE LA POBLACIÓN ESPAÑOLA\n•España destaca enelcontexto internacional porpresentar unaelevada esperanza devida alnacer\uf02den2022 ,83,2años\uf02d\n•Noobstante ,laposición relativa deEspaña entérminos delaesperanza devida“enbuenasalud” esmás rezagada y,porejemplo, está pordetrás deAlemania,\nFrancia eItalia\nFuentes :Instituto Nacional deEstadística yEurostat .'
 '•Política fiscal :Elenvejecimiento poblacional yaestá suponiendo unincremento apreciable delgasto público, tanto enpensiones como en\nsanidad ycuidados delarga duración ;unadinámica queseintensificará enelfuturo\uf0aeAcometer sindemora unproceso deconsolidación\nfiscal ambicioso conunaperspectiva temporal demedio plazo .Como parte deeste proceso, evaluar demanera continua yrigurosa la\nsostenibilidad financiera delsistema público depensiones']","Durante 2023, la inflación en España continuó una moderación más intensa de lo esperado, impulsada principalmente por una evolución favorable de los precios de la energía. Se prevé que la inflación siga desacelerándose gradualmente en los próximos trimestres.",0.0,0.8159013432879215,0.49999999995,0.8333333333333334
¿Qué impacto ha tenido la volatilidad de los precios del petróleo en los resultados financieros de Repsol?,"El envejecimiento poblacional en España se caracteriza por una baja tasa de fecundidad y una alta esperanza de vida, lo que supone un desafío para el mercado laboral y las finanzas públicas debido al incremento del gasto en pensiones y sanidad. Se requieren políticas para promover la prolongación de la vida laboral y mejorar la formación continua.La volatilidad de los precios del petróleo ha afectado los ingresos de Repsol, aunque la compañía ha logrado mitigar los impactos a través de estrategias de cobertura y diversificación de sus fuentes de ingresos.","['en el análisis de la solvencia y de los hábitos de pago de cada cliente.  La Sociedad no tiene una concentración \nsignificativa de riesgo de crédito con terceros por deudas comerciales a cobrar (1,5% del total).\n5.4)\t Riesgo\tde\tprecio\tde\tcommodities\nEl riesgo de precio de commodities está asociado a la volatilidad de los precios del petróleo, productos \nderivados, gas natural y electricidad, así como de otras  commodities  propias de la actividad del Grupo Repsol. Si'
 'sus sociedades dependientes, ya que la materialización de un riesgo en los estados financieros de las filiales \npodría tener impacto en Repsol, S.A. a través de la valoración de su cartera de participaciones o de la retribución \nde las mismas mediante dividendos. Por tanto, para un adecuado análisis de riesgos, es necesario remitirse al \nInforme de Gestión Consolidado del Grupo Repsol, disponible en la web www.repsol.com, y a las Cuentas \nAnuales Consolidadas.'
 'decisión de Repsol), mientras que el tramo put no se llegó a ejercer.  El impacto en la cuenta de pérdidas y \nganancias en el ejercicio ha ascendido a 13 millones de euros, que se incluye en el epígrafe “Variación a valor \nrazonable de instrumentos financieros” de la cuenta de pérdidas y ganancias.\nEn 2023 se han contratado equity swaps  por un volumen de 35 millones de acciones a un precio promedio de']","El envejecimiento poblacional en España se caracteriza por una baja tasa de fecundidad y una alta esperanza de vida, lo que supone un desafío para el mercado laboral y las finanzas públicas debido al incremento del gasto en pensiones y sanidad. Se requieren políticas para promover la prolongación de la vida laboral y mejorar la formación continua.La volatilidad de los precios del petróleo ha afectado los ingresos de Repsol, aunque la compañía ha logrado mitigar los impactos a través de estrategias de cobertura y diversificación de sus fuentes de ingresos.",0.25,0.8207076928985703,0.9999999999666667,0.5
¿Cómo ha afectado la transición energética a las estrategias y operaciones de Repsol?,"La transición energética ha llevado a Repsol a invertir significativamente en energías renovables y a reorientar sus operaciones hacia fuentes de energía más sostenibles, lo que refleja su compromiso con la reducción de emisiones de carbono.","['requerirá a las empresas una estrategia de adaptación a la transición energética que Repsol ha iniciado ya. \nAsimismo, estas hipótesis son consistentes con las consideradas para definir la estrategia de Repsol y con los \nobjetivos contemplados en la actualización estratégica publicada en febrero de 2024 (PE24-27). Hay que advertir \nque el PE 24-27 presenta algunos escenarios de precios con la finalidad de demostrar la capacidad de la'
 'Repsol con la realidad del mercado global \nde hidrocarburos y los escenarios de \ntransición energética y cambio climático \nconsiderados globalmente.  \n \n• Entendido el mapa de los riesgos \nrelacionados con el cambio climático y la \ntransición energética que tiene identificados \ncomo Sociedad dominante del Grupo \nRepsol, y mantenido reuniones con la \ndirección para identificar las áreas en las \nque los riesgos de la transición energética y  \nel cambio climático, identificados en el'
 'de venta del 25% de los negocios de exploración y producción y de generación eléctrica renovable a EIG y a EIP, \nrespectivamente (Véase Nota 9.1). La mencionada reorganización permite una gestión y financiación de las \nactividades del Grupo más ágiles y diferenciadas y facilitará la dinámica de construcción y transformación de sus \nejes de negocio en un contexto de transición energética.\nEn el marco de este proceso de reestructuración, se han realizado diversas operaciones que afectan a Repsol,']","La transición energética ha llevado a Repsol a invertir significativamente en energías renovables y a reorientar sus operaciones hacia fuentes de energía más sostenibles, lo que refleja su compromiso con la reducción de emisiones de carbono.",1.0,0.8558152566142582,0.9999999999666667,1.0
¿Qué medidas ha implementado Repsol para mejorar su sostenibilidad financiera y operativa?,"Repsol ha implementado medidas como la optimización de su portafolio de activos, la reducción de deuda y la inversión en tecnología para mejorar su sostenibilidad financiera y operativa a largo plazo.","['y (iv) el registro contable de operaciones societarias (ver Nota 9).\nEstas Cuentas Anuales reflejan la estrategia de Repsol para ser una compañía cero emisiones netas en 2050, \nalineada con los objetivos del Acuerdo de París y los de Desarrollo Sostenible de Naciones Unidas. En este \nsentido, Repsol ha tenido en cuenta los impactos del cambio climático y la descarbonización de la economía en \nla definición de las estimaciones y juicios contables, especialmente en la evaluación del valor recuperable de los'
 'decisión de Repsol), mientras que el tramo put no se llegó a ejercer.  El impacto en la cuenta de pérdidas y \nganancias en el ejercicio ha ascendido a 13 millones de euros, que se incluye en el epígrafe “Variación a valor \nrazonable de instrumentos financieros” de la cuenta de pérdidas y ganancias.\nEn 2023 se han contratado equity swaps  por un volumen de 35 millones de acciones a un precio promedio de'
 'A lo largo del 2023, tras cumplir gran parte de los objetivos fijados en el Plan Estratégico 2021-2025, Repsol ha \nllevado a cabo una reflexión estratégica que ha culminado con la publicación de una actualización estratégica \npara el período 2024-2027 (Plan Estratégico 24-27). Esta actualización se basa en tres pilares: (i) crecimiento \nsignificativo del dividendo por acción en 2024 (30% con respecto a 2023) con una senda de un 3% adicional']","Repsol ha implementado medidas como la optimización de su portafolio de activos, la reducción de deuda y la inversión en tecnología para mejorar su sostenibilidad financiera y operativa a largo plazo.",0.0,0.937539379187526,0.9999999999666667,0.0
