question,answer,contexts,ground_truth,faithfulness,answer_relevancy,context_precision,context_recall
Quines són les principals causes de l'augment del PIB de Catalunya el 2022 segons l'informe financer?,"L'augment del PIB de Catalunya el 2022, que ha estat del 5,5%, s'atribueix a factors com la recuperació del consum de les llars, l'augment de la inversió en béns d'equipament i construcció, així com un fort increment de les exportacions totals, especialment impulsades pel turisme estranger.","['Generalitat\nde Catalunya\nInforme Financer\nAnual 2022'
 '41\nInforme  fInancer  anual  2022VI. Anàlisi financera i política d’endeutament\nIncrement del deute \nviu i minoració de \nl’import avalatEl volum de deute viu de la Generalitat de Catalunya en el tancament de 2022 es \nsitua en 79.135\xa0M€, dels quals 78.662\xa0M€ corresponen a deute a llarg termini. \nL’augment del deute de la Generalitat de Catalunya és causat, en part, pel dèficit \npúblic i, en part, per l’absorció del deute de les empreses del sector públic, tant a'
 '40\nInforme  fInancer  anual  2022Sector públic administratiu consolidat * de la Generalitat de Catalunya \n(Despesa meritada en milions d’euros)\n% Var. \nDESPESA 2019 2020 2021 2022 2022/2021\nI. Despeses de personal 7.781 8.885 9.685 9.874 2,0%\nII. Compres de béns i serveis 8.622 10.888 11.181 11.620 3,9%\nIII. Despeses financeres 797 710 657 633 –3,5%\nIV. Transferències corrents 7.901 10.014 12.084 10.802 –10,6%\nDespeses corrents 25.100 30.498 33.607 32.930 –2,0%\nVI. Inversions reals 445 726 664 913 37,4%']","L'augment del PIB de Catalunya el 2022, que ha estat del 5,5%, s'atribueix a factors com la recuperació del consum de les llars, l'augment de la inversió en béns d'equipament i construcció, així com un fort increment de les exportacions totals, especialment impulsades pel turisme estranger.",,,,
Quins sectors econòmics han tingut una evolució més positiva i quins han patit més durant el 2022?,"Els sectors que han tingut una evolució més positiva són els serveis, especialment el comerç, transport i hostaleria, amb un creixement del 7,9%. En canvi, la indústria ha patit una contracció del 2,0%, i el sector agrari ha experimentat una caiguda del 13,9%.","['valor global derivats de la pandèmia i de les mesures de contenció aplicades. \nLa recuperació del 2021 va ser només parcial, amb un creixement del 5,1\xa0%, en \nun marc d’incertesa creixent. L’any 2022, la situació de la indústria s’ha vist molt \nperjudicada per l’increment dels preus energètics i els problemes d’abastiment \nen els subministraments, fet que ha suposat una evolució negativa del sector, \nque s’ha contret un –2,0\xa0%. Destaca l’evolució a la baixa de la fabricació de ve -'
 'què les previsions macroeconòmiques van divergir notablement de l’evolució real \nde l’economia de forma que els recursos aportats per les bestretes van excedir \namb escreix als definitius, generant una liquidació negativa dos anys més tard, \nal contrari que altres exercicis en què la liquidació és positiva però els recursos \narriben amb un decalatge de dos anys. Dels últims dos anys liquidats, el 2019 i \n2020, liquidats respectivament els anys 2021 i 2022, la Generalitat va ingressar'
 'aquell any es van rebre unes bestretes corresponents a unes previsions macro -\neconòmiques que no es van complir, afectades per la pandèmia i l’aturada de \nl’activitat econòmica, així com les restriccions, que van fer caure el consum i la \nrecaptació de 2020. L’Estat ha volgut compensar aquestes liquidacions nega -\ntives, i ho ha fet realitzant una transferència per import de 538\xa0M€, que deixa \na zero aquest sumatori dels imports positius i negatius de les liquidacions de']","Els sectors que han tingut una evolució més positiva són els serveis, especialment el comerç, transport i hostaleria, amb un creixement del 7,9%. En canvi, la indústria ha patit una contracció del 2,0%, i el sector agrari ha experimentat una caiguda del 13,9%.",,,,
Quina és la importància del turisme estranger per a l'economia catalana segons l'informe?Com es distribueixen les competències entre l'Estat i la Generalitat de Catalunya segons l'informe financer?,"El turisme estranger ha estat crucial per a l'economia catalana el 2022, amb un total de 14,9 milions de turistes i una despesa de 16.479 milions d'euros, representant el 20,7% del total de turistes estrangers a Espanya.","['I. Introducció  7\nII. Característiques principals de l’economia catalana 8\nIII. La Generalitat de Catalunya: estructura institucional  \ni competències  17\nIV. El finançament de la Generalitat de Catalunya  21\nV. Anàlisi pressupostària  32\nVI. Anàlisi financera i política d’endeutament  41\nApèndix. Sector Públic de la Generalitat de Catalunya* 52Índex'
 '17\nInforme  fInancer  anual  2022III. La Generalitat de Catalunya: estructura institucional \ni competències\nIII.1. Els organismes al servei de la Generalitat de Catalunya\nOrganització basada \nen institucions \nhistòriquesEl 9 d’agost de 2006 va entrar en vigor l’actual Estatut d’autonomia de Catalunya \nque defineix les institucions polítiques catalanes, les competències i les relaci -\nons amb l’Estat. L’Estatut va ser aprovat prèviament per les Corts espanyoles, i'
 'ConstitucióL’ordenació territorial de l’Estat es recull en el títol VIII de la Constitució, d’on \nderiva la distribució de competències entre Estat i comunitats autònomes. Con -\ncretament, les competències de la Generalitat de Catalunya s’enumeren en el \ntítol quart de l’Estatut d’autonomia.\nDiversos tipus de \ncompetènciesEn l’esquema de distribució competencial entre l’Estat i la Generalitat de Cata -\nlunya és possible distingir els nivells de responsabilitat següents:']","El turisme estranger ha estat crucial per a l'economia catalana el 2022, amb un total de 14,9 milions de turistes i una despesa de 16.479 milions d'euros, representant el 20,7% del total de turistes estrangers a Espanya.",,0.0,,1.0
Com afecta la capacitat fiscal a la distribució de recursos entre comunitats autònomes?,"Les competències es distribueixen en competències exclusives, compartides i executives, amb la Generalitat exercint un alt nivell d'autonomia en àrees com l'agricultura, cultura, dret civil, i ordenació territorial, entre altres.","['cooperació:\n• El fons de competitivitat està destinat a les comunitats autònomes que \ntenen un finançament per càpita inferior a la mitjana o inferior al seu índex \nde capacitat fiscal. Té com a objectiu reduir les diferències en els recursos \nper càpita i incentivar l’autonomia i la capacitat fiscal. Aquest fons es dis -\ntribueix entre les comunitats autònomes beneficiàries –entre les quals es \ntroba Catalunya– segons la seva població ajustada relativa.'
 '23\nInforme  fInancer  anual  2022Població ajustada\nPoblació protegida equivalent distribuïda per 7 grups d’edat 38,0 %\nPoblació 30,0 %\nPoblació de 0 a 16 anys 20,5 %\nPoblació de més de 65 anys\xa0 8,5 %\nVariables poblacionals 97,0 %\nSuperfície 1,8 %\nDispersió 0,6 %\nInsularitat 0,6 %\nResta de variables 3,0 %\nTOTAL 100,0 %\nLes comunitats autònomes amb una capacitat fiscal inferior a les necessitats \nrebran una transferència positiva. En cas contrari, és a dir, si la capacitat fiscal'
 'de forma que la posició relativa que ocupa cada comunitat autònoma varia \nrespecte a l’observada en termes de recursos tributaris per habitant. Així, \nl’any 2020, comunitats que tenen una capacitat fiscal superior a la mitjana, \ncom Madrid, les Illes Balears o Catalunya, amb uns índexs del 141, 117 \ni 116,2, respectivament, acaben tenint uns recursos inferiors, amb uns \níndexs del 97,8, 98,5 i 99,7. D’una altra banda, comunitats que tenen']","Les competències es distribueixen en competències exclusives, compartides i executives, amb la Generalitat exercint un alt nivell d'autonomia en àrees com l'agricultura, cultura, dret civil, i ordenació territorial, entre altres.",,,0.0,
Quin impacte han tingut les transferències estatals en els ingressos no financers de la Generalitat de Catalunya el 2022?,"La capacitat fiscal determina que les comunitats autònomes amb menor capacitat rebin transferències positives per equilibrar els recursos necessaris per finançar els serveis públics fonamentals, mentre que aquelles amb major capacitat han de fer aportacions a les altres comunitats.","['22\nInforme  fInancer  anual  2022en l’any 2021 es va rebre una transferència extraordinària per part de l’Estat per \npoder fer front a la despesa Covid, i que en l’any 2022 ja no s’ha rebut. Per tant, \naquest any es recupera la rellevància del model de finançament que la Generalitat \ntenia abans de la pandèmia.\nEls ingressos tributaris procedents de la cistella d’impostos, totalment o par -\ncialment cedits, representen la pràctica totalitat dels ingressos del model de'
 '41\nInforme  fInancer  anual  2022VI. Anàlisi financera i política d’endeutament\nIncrement del deute \nviu i minoració de \nl’import avalatEl volum de deute viu de la Generalitat de Catalunya en el tancament de 2022 es \nsitua en 79.135\xa0M€, dels quals 78.662\xa0M€ corresponen a deute a llarg termini. \nL’augment del deute de la Generalitat de Catalunya és causat, en part, pel dèficit \npúblic i, en part, per l’absorció del deute de les empreses del sector públic, tant a'
 'Els Pressupostos Generals de l’Estat per al 2022 van establir una transferència \ncorrent per l’import de les liquidacions negatives del model de finançament de \nles comunitats autònomes. Aquesta manera d’implementar la compensació de \nles devolucions fa que l’evolució d’alguns capítols no sigui un bon indicador dels \ningressos efectius: el capítol 4 de transferències corrents inclou aquest import \npositiu i els diferents impostos i fons del model contenen la liquidació calculada']","La capacitat fiscal determina que les comunitats autònomes amb menor capacitat rebin transferències positives per equilibrar els recursos necessaris per finançar els serveis públics fonamentals, mentre que aquelles amb major capacitat han de fer aportacions a les altres comunitats.",,,1.0,
What were Accenture's total revenues and operating margins for the fourth quarter of fiscal 2023?,"Les transferències estatals van tenir un gran impacte el 2021 a causa de la despesa Covid, però el 2022, la seva reducció ha fet que els ingressos no financers tornin a dependre més del model de finançament autonòmic tradicional.","['Accenture Reports Fourth-Quarter and Strong Full-Year Fiscal 2023 Results\n-- For the fourth quarter, revenues are $16.0 billion , an increase of 4% in both U.S. dollars and \nlocal currency; GAAP operating margin is 12.0% , compared to 14.7%  in the fourth quarter of \nfiscal 2022; adjusted1 operating margin is 14.9% , an expansion of 20 basis points --\n-- For full fiscal year, revenues are $64.1 billion , an increase of 4% in U.S. dollars and 8% in'
 'Accenture plc\nConsolidated Income Statements\n(In thousands of U.S. dollars, except share and per share amounts)\n(Unaudited)\n Three Months Ended Year Ended\n August 31,\n2023% of \nRevenuesAugust 31,\n2022% of \nRevenuesAugust 31,\n2023% of \nRevenuesAugust 31,\n2022% of \nRevenues\nREVENUES:\nRevenues $ 15,985,200  100.0 % $ 15,423,656  100.0 % $ 64,111,745  100.0 % $ 61,594,305  100.0 %\nOPERATING EXPENSES:\nCost of services  10,803,571  67.6 %  10,477,599  67.9 %  43,380,138  67.7 %  41,892,766  68.0 %'
 'Accenture  expects GAAP operating margin for fiscal 2024  to be in the range of 14.8% to \n15.0%, an expansion of 110 to 130 basis points from fiscal 2023, and adjusted operating \nmargin, which excludes an estimated $450 million for business optimization costs, to be in the \nrange of 15.5% to 15.7%, an expansion of 10 to 30 basis points from fiscal 2023 .\nThe company expects both its GAAP and adjusted annual effective tax rate, which excludes the']","Les transferències estatals van tenir un gran impacte el 2021 a causa de la despesa Covid, però el 2022, la seva reducció ha fet que els ingressos no financers tornin a dependre més del model de finançament autonòmic tradicional.",,,,0.6044882082965638
"What were the new bookings for Accenture in the fourth quarter of fiscal 2023, and how did they compare to the previous year?","Accenture's total revenues for the fourth quarter of fiscal 2023 were $16.0 billion, with a GAAP operating margin of 12.0%. The adjusted operating margin was 14.9%.","['-- New bookings are $16.6 billion  for the quarter and $72.2 billion  for the full-year, a 1% increase \nin U.S. dollars and 5% increase in local currency over full-year fiscal 2022  new bookings --\n-- 15% increase in quarterly dividend to $1.29  per share; Board of Directors approves \n$4.0 billion  of additional share repurchase authority --  \n-- For fiscal year 2024, Accenture expects revenue growth of 2% to 5% in local currency; GAAP'
 'Days services outstanding, or DSOs, were 42 days at August 31, 2023 , compared with 43 days \nat August 31, 2022 . \nAccenture’s total cash balance at August 31, 2023  was $9.0 billion , compared with $7.9 billion  at \nAugust 31, 2022 .\nNew Bookings\nNew bookings for the fourth quarter of fiscal 2023  were $16.6 billion , a decrease of 10% in both \nU.S. dollars and local currency from the fourth quarter of fiscal 2023 .  \n•Consulting new bookings were $8.5 billion , or 51% of total new bookings.'
 'Julie Sweet, chair and CEO, Accenture, said, “I am extremely proud that we have achieved \nanother strong year of financial performance in fiscal year 2023. Our ability to remain laser-\nfocused on meeting the needs of our clients is reflected in new bookings of $72 billion  in fiscal \n2023; 106 clients with quarterly bookings of more than $100 million; and reaching a record 300 \nDiamond clients, our largest relationships. Our clients’ generative AI bookings of $300 million in']","Accenture's total revenues for the fourth quarter of fiscal 2023 were $16.0 billion, with a GAAP operating margin of 12.0%. The adjusted operating margin was 14.9%.",0.0,0.0,,0.0
What revenue trends were observed in Accenture's key geographic markets during the fourth quarter of fiscal 2023?,"New bookings for Accenture in the fourth quarter of fiscal 2023 were $16.6 billion, a decrease of 10% compared to the previous year.","['Accenture plc\nSummary of Revenues\n(In thousands of U.S. dollars)\n(Unaudited)\n  Three Months EndedPercent\nIncrease \n(Decrease) \nU.S.\nDollarsPercent\nIncrease \n(Decrease) \nLocal\nCurrency   August 31, 2023 August 31, 2022\nGEOGRAPHIC MARKETS\nNorth America $ 7,553,990 $ 7,523,505 —% 1%\nEurope  5,297,437  4,803,237 10 7\nGrowth Markets  3,133,773  3,096,914 1 6\nTotal Revenues $ 15,985,200 $ 15,423,656 4% 4%\nINDUSTRY GROUPS \nCommunications, Media & Technology $ 2,707,722 $ 3,081,007 (12)% (12)%'
 'Accenture Reports Fourth-Quarter and Strong Full-Year Fiscal 2023 Results\n-- For the fourth quarter, revenues are $16.0 billion , an increase of 4% in both U.S. dollars and \nlocal currency; GAAP operating margin is 12.0% , compared to 14.7%  in the fourth quarter of \nfiscal 2022; adjusted1 operating margin is 14.9% , an expansion of 20 basis points --\n-- For full fiscal year, revenues are $64.1 billion , an increase of 4% in U.S. dollars and 8% in'
 'to $16.45 billion, or -2% to 2% in local currency, reflecting the company’s assumption of a \npositive 2.5% foreign-exchange impact compared with the first quarter of fiscal 2023 .\nFiscal Year 2024\n \nAccenture’s business outlook for the full 2024 fiscal year assumes that the foreign-exchange \nimpact on its results in U.S. dollars will be flat compared with fiscal 2023 . For fiscal 2024 , the \ncompany expects revenue growth to be in the range of 2% to 5% in local currency.']","New bookings for Accenture in the fourth quarter of fiscal 2023 were $16.6 billion, a decrease of 10% compared to the previous year.",0.0,0.0,,0.0
"What changes occurred in NTT Data's total assets and equity between March 31, 2024, and June 30, 2024?","During the fourth quarter of fiscal 2023, revenues in North America remained flat in U.S. dollars but increased by 1% in local currency, while Europe saw a 10% increase in U.S. dollars and 7% in local currency, and Growth Markets experienced a 1% increase in U.S. dollars and 6% in local currency.","['Note:  NTT conducted  a 25-for-1 stock split of its common  stock, with an effective  date  of July 1, 2023. The figures for Shareholders’ Equity  per Share have  been adjusted to reflect  the impact of  the\n\u3000\u3000  stock  split as if the stock  split had occurred  at the beginning  of the prior fiscal  year.\n2.  Dividends\nNote : Revision to the  dividend forecasts from  the latest  announcement:  None'
 'June 30, 2024 : 90,550,316,400 shares\nMarch 31, 2024 : 90,550,316,400 shares\nJune 30, 2024 :   6,467,282,494 shares\nMarch 31, 2024 :   6,468,768,847 shares\nFor the three  months ended June 30, 2024 : 84,081,781,237 shares\nFor the three  months ended June 30, 2023 : 85,235,489,679 shares*Notes:\n(1)    Significant  changes in  the scope of consolidation  during the three  months ended June 30, 2024:  None\n(2)    Change  of accounting policy  and accounting  estimates'
 ""to NTTDiluted Earnings\nper Share\nAttributable  to NTT\nThree months ended  June 30, 2024 3.26 (yen) －(yen)\nThree months ended  June 30, 2023 4.41 (yen) －(yen)\n(2) Consolidated Financial  Position (Millions of yen, except  equity  ratio and per share amounts)\nTotal AssetsTotal  Equity\n(Net Assets)Shareholders'\nEquityEquity  Ratio\n(Ratio of Shareholders'  \nEquity to Total  Assets)Shareholders'\nEquity  per Share\nJune 30, 2024 29,989,405 11,068,578 9,968,123 33.2% 118.55 (yen)""]","During the fourth quarter of fiscal 2023, revenues in North America remained flat in U.S. dollars but increased by 1% in local currency, while Europe saw a 10% increase in U.S. dollars and 7% in local currency, and Growth Markets experienced a 1% increase in U.S. dollars and 6% in local currency.",,,,
"How did NTT Data's consolidated financial results for the fiscal year ending March 31, 2025, compare to the previous fiscal year?","Between March 31, 2024, and June 30, 2024, NTT Data's total assets increased from ¥29,604,223 million to ¥29,989,405 million, while total equity rose from ¥10,893,059 million to ¥11,068,578 million.","['3.  Consolidated  Financial  Results Forecasts for the Fiscal Year  Ending  March  31, 2025 (April 1, 2024 - March 31, 2025)\nNotes: 1. Percentages  above represent  changes from the previous fiscal  year.\n\u3000\u3000\u30002. Revision to the  consolidated  financial  results forecasts from the latest  announcement:  None- 1 -'
 'Attributable  to NTT\nYear Ending\nMarch  31, 202513,460,000 0.6% 1,810,000 (5.9)% 1,720,000 (13.2)% 1,100,000 (14.0)% 13.00 (yen)1.  Consolidated Financial Results for the Three Months Ended June 30, 2024 (April 1, 2024 - June 30, 2024)\nAmounts are rounded  to the nearest  million yen.\nNotes:  1. Comprehensive income  (loss) attributable  to NTT:   For  the three months ended  June 30, 2024:  351,706 million  yen (41.2)%\n  For the three months  ended June 30, 2023:  597,851 million  yen 32.2%'
 '2. Percentages  above represent  changes from the  corresponding period of previous fiscal  year.\nNote:  NTT conducted  a 25-for-1 stock split of its common  stock, with an effective  date  of July 1, 2023. The figures for Basic Earnings  per Share Attributable  to NTT have  been adjusted to  reflect\n\u3000\u3000  the impact  of the stock split as if  the stock split had  occurred at the  beginning of the prior  fiscal year.']","Between March 31, 2024, and June 30, 2024, NTT Data's total assets increased from ¥29,604,223 million to ¥29,989,405 million, while total equity rose from ¥10,893,059 million to ¥11,068,578 million.",,,0.6666666666666666,0.5
"What were the trends in NTT Data's cash flows from operating, investing, and financing activities during the three months ended June 30, 2024?","NTT Data's consolidated financial results forecast for the fiscal year ending March 31, 2025, includes expected operating revenues of ¥13,460,000 million, a 0.6% increase, and a profit attributable to NTT of ¥1,100,000 million, a 14.0% decrease compared to the previous fiscal year.","['June 30, 2024 : 90,550,316,400 shares\nMarch 31, 2024 : 90,550,316,400 shares\nJune 30, 2024 :   6,467,282,494 shares\nMarch 31, 2024 :   6,468,768,847 shares\nFor the three  months ended June 30, 2024 : 84,081,781,237 shares\nFor the three  months ended June 30, 2023 : 85,235,489,679 shares*Notes:\n(1)    Significant  changes in  the scope of consolidation  during the three  months ended June 30, 2024:  None\n(2)    Change  of accounting policy  and accounting  estimates'
 'Millions of yen\nThree  Months  Ended  \nJune 30, 2023Three  Months  Ended \nJune 30, 2024Increase\n(Decrease)\nCash flows from financing activities\nNet increase  (decrease) in short-term  borrowings 685,931 676,086 (9,845)\nProceeds from increases  in long-term borrowings 3,130 334,189 331,059\nRepayment  of long-term borrowings (98,684) (207,306) (108,622)\nRepayment  of lease liabilities (63,215) (73,185) (9,970)\nPayments for acquisition  of interests in  subsidiaries from'
 'subsidiaries, ” which had previously been  presented within “Other,  net” in cash  flows  from  investing activities  for the three  months\n       ended  June 30, 2023, are now presented separately  for the three  months ended June 30, 2024 due to an  increase in the  materiality\n       of the  amount of such items.  As a result  of this change, the  ¥17,312 million amount  that had  previously been presented  as “Other,']","NTT Data's consolidated financial results forecast for the fiscal year ending March 31, 2025, includes expected operating revenues of ¥13,460,000 million, a 0.6% increase, and a profit attributable to NTT of ¥1,100,000 million, a 14.0% decrease compared to the previous fiscal year.",0.8142192106090578,0.0,1.0,
¿Cuáles son los principales retos estructurales que enfrenta la economía española según el informe del Banco de España?,"During the three months ended June 30, 2024, NTT Data's cash flows from operating activities decreased by ¥145,742 million compared to the previous year, while cash used in investing activities increased by ¥135,046 million, and cash provided by financing activities increased by ¥193,981 million.","['DIRECCIÓN GENERAL DE ECONOMÍA Y ESTADÍSTICA –BANCO DE ESPAÑA1.Mensajes principales\n2.Dinámicas recientes de la actividad económica en España\n3.Retos estructurales de la economía españolaÍNDICE DE ESTA PRESENTACIÓN\n3'
 'DIRECCIÓN GENERAL DE ECONOMÍA Y ESTADÍSTICA –BANCO DE ESPAÑAGRACIAS POR SU ATENCIÓN'
 'DIRECCIÓN GENERAL DE ECONOMÍA Y ESTADÍSTICA –BANCO DE ESPAÑA 2Capítulo 1\nCapítulo 2\nCapítulo 3\nCapítulo 4 Laresiliencia delaeconomía española enelcontexto europeo\nRetos estructurales delaeconomía española\nElmercado detrabajo español :situación actual, tendencias estructurales ypolíticas deempleo\nElmercado delavivienda enEspaña :evolución reciente, riesgos yproblemas deaccesibilidadINFORME ANUAL 2023 DEL BANCO DE ESPAÑA']","During the three months ended June 30, 2024, NTT Data's cash flows from operating activities decreased by ¥145,742 million compared to the previous year, while cash used in investing activities increased by ¥135,046 million, and cash provided by financing activities increased by ¥193,981 million.",0.0,0.0,,
¿Cómo se ha comportado la inflación en España durante 2023 y cuáles son las perspectivas para los próximos años?,"Los principales retos estructurales que enfrenta la economía española incluyen impulsar el crecimiento de la productividad, reducir la elevada tasa de paro estructural, incrementar el tamaño empresarial, mejorar la calidad y confianza en las instituciones, reforzar la sostenibilidad de las cuentas públicas, y afrontar los desafíos del envejecimiento poblacional y la transición ecológica.","['14\nInforme  fInancer  anual  2022L’any 2022 la inflació \nprotagonitza el \npanorama econòmic \ni a Catalunya \nassoleix una taxa \nmitjana anual d’un \n8,0\xa0%La inflació del 2021 va mostrar un progressiu augment en gran part dels grups \nde despesa que conformen la cistella de consum de l’IPC. Tot i això, la inflació \nsubjacent encara es mantenia moderada. El 2022, la guerra d’Ucraïna i les ten -\nsions geopolítiques amb Rússia han pressionat a l’alça els preus dels combusti -'
 'DIRECCIÓN GENERAL DE ECONOMÍA Y ESTADÍSTICA –BANCO DE ESPAÑA 19EN 2023, CONTINUÓ LA MODERACIÓN DE LAS TASAS DE INFLACIÓN \nGENERAL , UN PROCESO QUE FUE MÁS INTENSO DE LO ESPERADO \nFuentes :Eurostat, Instituto Nacional deEstadística, Consensus yBanco deEspaña .\n(a)Laslíneas punteadas representan elmáximo yelmínimo entre lasinstituciones queforman parte delpanel deConsensus .'
 'I. Durante 2023, la economía global se ha mostrado relativamente resiliente pero ha sufrido una elevada \nincertidumbre. El contexto internacional ha venido marcado por las decisiones de política monetaria \npara hacer frente a la inflación y por la evolución de un convulso escenario geopolítico. Los precios \ninternacionales de referencia para buena parte de los productos energéticos se han reducido de']","Los principales retos estructurales que enfrenta la economía española incluyen impulsar el crecimiento de la productividad, reducir la elevada tasa de paro estructural, incrementar el tamaño empresarial, mejorar la calidad y confianza en las instituciones, reforzar la sostenibilidad de las cuentas públicas, y afrontar los desafíos del envejecimiento poblacional y la transición ecológica.",,,,
¿Cómo se describe el proceso de envejecimiento poblacional en España y cuáles son sus implicaciones económicas?,"Durante 2023, la inflación en España continuó una moderación más intensa de lo esperado, impulsada principalmente por una evolución favorable de los precios de la energía. Se prevé que la inflación siga desacelerándose gradualmente en los próximos trimestres.","['DIRECCIÓN GENERAL DE ECONOMÍA Y ESTADÍSTICA –BANCO DE ESPAÑA 12RETOS ESTRUCTURALES DE LA ECONOMÍA ESPAÑOLA\nENVEJECIMIENTO POBLACIONALDinámicas \ndemográficas•Alolargo delasúltimas décadas, lasdinámicas demográficas enEspaña sehancaracterizado porunacaída significativa tanto delatasa\ndefecundidad como delatasa demortalidad \uf0aeconsiderable proceso deenvejecimiento poblacional ...\n•...queseintensificará enlaspróximas décadas yqueserá más acusado queeldeotros países denuestro entorno [Entre 2023 y2053 ,latasa de'
 'DIRECCIÓN GENERAL DE ECONOMÍA Y ESTADÍSTICA –BANCO DE ESPAÑA 11RETOS ESTRUCTURALES DE LA ECONOMÍA ESPAÑOLA\nMARCO INSTITUCIONALContexto EvidenciaÁreas en las \nque incidir•Existe unamplio consenso enlaliteratura académica enqueelmarco institucional y,más enconcreto, lacalidad delasinstituciones yel\ngrado deconfianza quegeneran enlosdistintos agentes económicos sonundeterminante fundamental delcrecimiento alargo plazo'
 'En este sentido, para el registro contable de las operaciones de reorganización societaria, Repsol analiza la \nrealidad económica subyacente en cada operación y no únicamente la forma jurídica de las mismas, de acuerdo \ncon lo previsto en el marco conceptual del Plan General de Contabilidad. Como parte del análisis se tienen en \ncuenta diversos factores, entre los que destaca la existencia o no de un desplazamiento de fondos desde la']","Durante 2023, la inflación en España continuó una moderación más intensa de lo esperado, impulsada principalmente por una evolución favorable de los precios de la energía. Se prevé que la inflación siga desacelerándose gradualmente en los próximos trimestres.",,,0.0,0.0
¿Qué impacto ha tenido la volatilidad de los precios del petróleo en los resultados financieros de Repsol?,"El envejecimiento poblacional en España se caracteriza por una baja tasa de fecundidad y una alta esperanza de vida, lo que supone un desafío para el mercado laboral y las finanzas públicas debido al incremento del gasto en pensiones y sanidad. Se requieren políticas para promover la prolongación de la vida laboral y mejorar la formación continua.La volatilidad de los precios del petróleo ha afectado los ingresos de Repsol, aunque la compañía ha logrado mitigar los impactos a través de estrategias de cobertura y diversificación de sus fuentes de ingresos.","['– Para el cálculo de las previsiones de los precios de la electricidad en España se utiliza un modelo propio que \npondera la influencia de los distintos factores en el mercado mayorista. Si bien el modelo responde \nprincipalmente a los precios del gas natural y los derechos de emisiones de CO2, también se refleja el \nimpacto que tendrán los nuevos desarrollos futuros de capacidad de generación renovable, así como las'
 '– Las sendas de precios del petróleo, del gas natural, de la electricidad y del CO2 utilizadas para el test de \ndeterioro son estimaciones propias, que se contrastan con los escenarios de agencias internacionales y \notros actores del mercado. Las sendas se elaboran a partir de la información macroeconómica, financiera, \nde mercado y de las previsiones disponibles de analistas.\nEn particular, para el cálculo de precios del crudo y gas se analizan las variables clave del mercado y de su'
 'más significativas las siguientes: Repsol, S.A., Repsol Petróleo, S.A., Repsol Trading, S.A., Repsol Química, S.A., \nRepsol Butano, S.A., Repsol Comercial de Productos Petrolíferos, S.A., Repsol Exploración, S.A., Repsol \nExploración Murzuq, S.A., Repsol Generación Eléctrica, S.A. y Repsol Renovables, S.L.U.\nEl cálculo del Impuesto sobre Sociedades se realiza sobre la base del resultado económico, obtenido por la']","El envejecimiento poblacional en España se caracteriza por una baja tasa de fecundidad y una alta esperanza de vida, lo que supone un desafío para el mercado laboral y las finanzas públicas debido al incremento del gasto en pensiones y sanidad. Se requieren políticas para promover la prolongación de la vida laboral y mejorar la formación continua.La volatilidad de los precios del petróleo ha afectado los ingresos de Repsol, aunque la compañía ha logrado mitigar los impactos a través de estrategias de cobertura y diversificación de sus fuentes de ingresos.",0.0,0.5,0.6541139388826568,0.0
¿Cómo ha afectado la transición energética a las estrategias y operaciones de Repsol?,"La transición energética ha llevado a Repsol a invertir significativamente en energías renovables y a reorientar sus operaciones hacia fuentes de energía más sostenibles, lo que refleja su compromiso con la reducción de emisiones de carbono.","['requerirá a las empresas una estrategia de adaptación a la transición energética que Repsol ha iniciado ya. \nAsimismo, estas hipótesis son consistentes con las consideradas para definir la estrategia de Repsol y con los \nobjetivos contemplados en la actualización estratégica publicada en febrero de 2024 (PE24-27). Hay que advertir \nque el PE 24-27 presenta algunos escenarios de precios con la finalidad de demostrar la capacidad de la'
 'por la dirección, elaborados en consonancia \ncon el escenario de transición energética y \ndescarbonización de la economía y los \ncompromisos de descarbonización adquiridos \npor Repsol.  \n \nEn las pruebas de deterioro, tal como se indica \nen las notas citadas, la Sociedad ha \nconsiderado previsiones sectoriales, la \nexperiencia pasada y sus expectativas futuras \nde la evolución de los negocios y del \ndesarrollo de mercado que contemplan \nescenarios de transición energética y'
 'restricción de uso de combustibles fósiles y el desarrollo de tecnologías alternativas, que impulsan la transición \nenergética y que supondrán una reducción de la demanda de productos de hidrocarburos a medio y largo plazo. \nEn concreto, las hipótesis consideradas por Repsol contemplan escenarios de transición energética, impulsados \npor las políticas de descarbonización, que están alineados con los objetivos del Acuerdo de París.']","La transición energética ha llevado a Repsol a invertir significativamente en energías renovables y a reorientar sus operaciones hacia fuentes de energía más sostenibles, lo que refleja su compromiso con la reducción de emisiones de carbono.",,,0.8584602921445416,0.0
¿Qué medidas ha implementado Repsol para mejorar su sostenibilidad financiera y operativa?,"Repsol ha implementado medidas como la optimización de su portafolio de activos, la reducción de deuda y la inversión en tecnología para mejorar su sostenibilidad financiera y operativa a largo plazo.","['y (iv) el registro contable de operaciones societarias (ver Nota 9).\nEstas Cuentas Anuales reflejan la estrategia de Repsol para ser una compañía cero emisiones netas en 2050, \nalineada con los objetivos del Acuerdo de París y los de Desarrollo Sostenible de Naciones Unidas. En este \nsentido, Repsol ha tenido en cuenta los impactos del cambio climático y la descarbonización de la economía en \nla definición de las estimaciones y juicios contables, especialmente en la evaluación del valor recuperable de los'
 'DIRECCIÓN GENERAL DE ECONOMÍA Y ESTADÍSTICA –BANCO DE ESPAÑAESCENARIO CON CONSOLIDACIÓN FISCAL (b)\n43ES NECESARIO DE IMPLEMENTAR, SIN DEMORA, UN PLAN DE CONSOLIDACIÓN PRESUPUESTARIA \nDE MEDIO PLAZO QUE REFUERCE LA SOSTENIBILIDAD DE LAS FINANZAS PÚBLI CAS\n•Deacuerdo conlasherramientas analíticas desarrolladas porelBanco deEspaña, enunescenario inercial\uf02dsincambios enlaspolíticas económicas yfiscales'
 'de la participada ajustado por las plusvalías tácitas existentes en la medida en que sea la mejor evidencia de su \nvalor recuperable o demuestre la inexistencia de un deterioro de valor sin necesidad de realizar un análisis más \ncomplejo.\nLas proyecciones de flujos de caja se basan en las mejores estimaciones disponibles de ingresos, gastos e \ninversiones de los activos, para lo que se utilizan previsiones sectoriales, experiencia pasada y expectativas']","Repsol ha implementado medidas como la optimización de su portafolio de activos, la reducción de deuda y la inversión en tecnología para mejorar su sostenibilidad financiera y operativa a largo plazo.",1.0,,,
