question,answer,contexts,ground_truth,faithfulness,answer_relevancy,context_precision,context_recall
Quines són les principals causes de l'augment del PIB de Catalunya el 2022 segons l'informe financer?,"L'augment del PIB de Catalunya el 2022, que ha estat del 5,5%, s'atribueix a factors com la recuperació del consum de les llars, l'augment de la inversió en béns d'equipament i construcció, així com un fort increment de les exportacions totals, especialment impulsades pel turisme estranger.","['9\nInforme  fInancer  anual  2022L’any 2022, el PIB de Catalunya ha assolit els 270.710 milions d’euros i el crei -\nxement en volum ha estat d’un 5,5\xa0%. Des de l’òptica de la demanda, cal re -\nmarcar l’augment del consum de les llars (4,1\xa0%, tot i que és un punt i quatre \ndècimes inferior al de l’any anterior) i de la formació bruta de capital (3,8\xa0%). Per \ncomponents, la inversió en béns d’equipament creix un 3,5\xa0% i la inversió en'
 '10\nInforme  fInancer  anual  2022era a Catalunya de 29.942\xa0€ (un 17,4\xa0% superior a la mitjana estatal). Val a dir \nque les estimacions de PIB de l’Idescat són una mica superiors i situen el PIB \nper habitant del 2021 en 31.617\xa0€. Segons aquestes darreres estimacions, el \nPIB per càpita de Catalunya en paritat de poder de compra del 2021 va superar \nen un 3,0\xa0% la mitjana de la Unió Europea. Una dada considerablement inferior \na la de l’any 2019, quan el PIB per habitant era un 12,7\xa0% superior al de la UE,'
 '7\nInforme  fInancer  anual  2022I. Introducció\nEl PIB català ha augmentat un 5,5 % el 2022, dos punts per sobre de la zona \neuro i al mateix ritme que l’economia espanyola. Des del segon trimestre de l’any, \nel PIB supera els nivells prepandèmia. L’entorn econòmic ha estat marcat per \nles polítiques de lluita contra la inflació a escala global, els efectes col·laterals \nde la guerra a Ucraïna i el conteniment de l’economia xinesa per les mesures \nrestrictives contra la pandèmia.']","L'augment del PIB de Catalunya el 2022, que ha estat del 5,5%, s'atribueix a factors com la recuperació del consum de les llars, l'augment de la inversió en béns d'equipament i construcció, així com un fort increment de les exportacions totals, especialment impulsades pel turisme estranger.",0.0,0.6291271534126714,0.9999999999666667,0.6666666666666666
Quins sectors econòmics han tingut una evolució més positiva i quins han patit més durant el 2022?,"Els sectors que han tingut una evolució més positiva són els serveis, especialment el comerç, transport i hostaleria, amb un creixement del 7,9%. En canvi, la indústria ha patit una contracció del 2,0%, i el sector agrari ha experimentat una caiguda del 13,9%.","['L’economia catalana ha resistit els xocs geopolític i inflacionari sense entrar en \nrecessió i tanca l’any millor del que s’esperava. El patró de creixement de l’eco -\nnomia catalana ha anat de més a menys durant el 2022. L’evolució del PIB s’ha \nalentit el 4t trimestre fins al 0,2 % intertrimestral i el 2,7 % interanual, a causa de \nla inflació (que, tot i moderar-se, continua sent elevada), les fortes pujades dels \ntipus d’interès i la crisi energètica i de subministraments.'
 'futuras de evolución del negocio y de desarrollo del mercado. Las estimaciones contemplan escenarios de \ntransición energética y descarbonización de la economía que son consistentes con los objetivos del Acuerdo de \nParís y con los compromisos de descarbonización adquiridos por Repsol, así como con los objetivos de la \nactualización del plan estratégico presentada en febrero de 2024 (PE24-27).\nLas variables macroeconómicas son las que se utilizan en la elaboración de los presupuestos y los planes de'
 'què les previsions macroeconòmiques van divergir notablement de l’evolució real \nde l’economia de forma que els recursos aportats per les bestretes van excedir \namb escreix als definitius, generant una liquidació negativa dos anys més tard, \nal contrari que altres exercicis en què la liquidació és positiva però els recursos \narriben amb un decalatge de dos anys. Dels últims dos anys liquidats, el 2019 i \n2020, liquidats respectivament els anys 2021 i 2022, la Generalitat va ingressar']","Els sectors que han tingut una evolució més positiva són els serveis, especialment el comerç, transport i hostaleria, amb un creixement del 7,9%. En canvi, la indústria ha patit una contracció del 2,0%, i el sector agrari ha experimentat una caiguda del 13,9%.",0.0,0.6645984763496192,0.8333333332916666,1.0
Quina és la importància del turisme estranger per a l'economia catalana segons l'informe?Com es distribueixen les competències entre l'Estat i la Generalitat de Catalunya segons l'informe financer?,"El turisme estranger ha estat crucial per a l'economia catalana el 2022, amb un total de 14,9 milions de turistes i una despesa de 16.479 milions d'euros, representant el 20,7% del total de turistes estrangers a Espanya.","['17\nInforme  fInancer  anual  2022III. La Generalitat de Catalunya: estructura institucional \ni competències\nIII.1. Els organismes al servei de la Generalitat de Catalunya\nOrganització basada \nen institucions \nhistòriquesEl 9 d’agost de 2006 va entrar en vigor l’actual Estatut d’autonomia de Catalunya \nque defineix les institucions polítiques catalanes, les competències i les relaci -\nons amb l’Estat. L’Estatut va ser aprovat prèviament per les Corts espanyoles, i'
 'I. Introducció  7\nII. Característiques principals de l’economia catalana 8\nIII. La Generalitat de Catalunya: estructura institucional  \ni competències  17\nIV. El finançament de la Generalitat de Catalunya  21\nV. Anàlisi pressupostària  32\nVI. Anàlisi financera i política d’endeutament  41\nApèndix. Sector Públic de la Generalitat de Catalunya* 52Índex'
 'milions d’euros, segons FDI Markets, la xifra més elevada de la sèrie històrica. \nUna de les raons de la localització a Catalunya és la qualitat i quantitat de serveis \nque hi ha disponibles per a les empreses, la imatge d’innovació i disseny així \ncom el prestigi d’alguns centres de formació universitària i de personal directiu.Rellevància de la \ncultura empresarial\nAmpli superàvit  \namb l’exteriorDurant el 2022, l’economia catalana manté un saldo positiu d’intercanvis de béns']","El turisme estranger ha estat crucial per a l'economia catalana el 2022, amb un total de 14,9 milions de turistes i una despesa de 16.479 milions d'euros, representant el 20,7% del total de turistes estrangers a Espanya.",0.0,0.6568914840659494,0.0,1.0
Com afecta la capacitat fiscal a la distribució de recursos entre comunitats autònomes?,"Les competències es distribueixen en competències exclusives, compartides i executives, amb la Generalitat exercint un alt nivell d'autonomia en àrees com l'agricultura, cultura, dret civil, i ordenació territorial, entre altres.","['1. El finançament per habitant en termes homogenis5 presenta diferències \nimportants entre comunitats amb valors que l’any 2020 –darrer any liqui -\ndat– oscil·laven entre el 92,9\xa0% i el 125,9\xa0% de la mitjana.\n5. Sense tenir en compte les competències especifiques traspassades a les comunitats autònomes \nni les decisions preses per les comunitats autònomes fent ús de la seva capacitat normativa \ntributària.'
 'de forma que la posició relativa que ocupa cada comunitat autònoma varia \nrespecte a l’observada en termes de recursos tributaris per habitant. Així, \nl’any 2020, comunitats que tenen una capacitat fiscal superior a la mitjana, \ncom Madrid, les Illes Balears o Catalunya, amb uns índexs del 141, 117 \ni 116,2, respectivament, acaben tenint uns recursos inferiors, amb uns \níndexs del 97,8, 98,5 i 99,7. D’una altra banda, comunitats que tenen'
 'cooperació:\n• El fons de competitivitat està destinat a les comunitats autònomes que \ntenen un finançament per càpita inferior a la mitjana o inferior al seu índex \nde capacitat fiscal. Té com a objectiu reduir les diferències en els recursos \nper càpita i incentivar l’autonomia i la capacitat fiscal. Aquest fons es dis -\ntribueix entre les comunitats autònomes beneficiàries –entre les quals es \ntroba Catalunya– segons la seva població ajustada relativa.']","Les competències es distribueixen en competències exclusives, compartides i executives, amb la Generalitat exercint un alt nivell d'autonomia en àrees com l'agricultura, cultura, dret civil, i ordenació territorial, entre altres.",0.0,0.5130997589074587,0.9999999999666667,0.8333333333333334
Quin impacte han tingut les transferències estatals en els ingressos no financers de la Generalitat de Catalunya el 2022?,"La capacitat fiscal determina que les comunitats autònomes amb menor capacitat rebin transferències positives per equilibrar els recursos necessaris per finançar els serveis públics fonamentals, mentre que aquelles amb major capacitat han de fer aportacions a les altres comunitats.","['34\nInforme  fInancer  anual  2022Estructura dels \ningressosEl total d’ingressos no financers liquidats del sector públic administratiu de la Ge -\nneralitat de Catalunya durant l’exercici 2022 ha estat de 31.959\xa0M€, que suposa \nuna reducció del 6,7\xa0%. L’exercici anterior es van ingressar les últimes transferèn -\ncies extraordinàries amb motiu de la COVID19. La liquidació dels ingressos del \nmodel de finançament del 2021 va ser positiva mentre que el 2022 va ser zero.'
 '1 Sense considerar les transferències que fa l’Estat per al finançament dels ens locals de Catalunya, \natès que la Generalitat només actua com a caixa pagadora.'
 'un deute viu a final de 2022 de 360,26\xa0 M€.\nPer atendre les seves necessitats financeres, la Generalitat de Catalunya també \nes va adherir al mecanisme de recolzament a la liquiditat de les comunitats au -\ntònomes, denominat Fons de liquiditat autonòmic (FLA) i creat pel Reial decret \nllei 21/2012, de 13 de juliol, de mesures de liquiditat de les administracions pú -\nbliques i en l’àmbit financer. Actualment, aquest mecanisme es regula pel Reial']","La capacitat fiscal determina que les comunitats autònomes amb menor capacitat rebin transferències positives per equilibrar els recursos necessaris per finançar els serveis públics fonamentals, mentre que aquelles amb major capacitat han de fer aportacions a les altres comunitats.",0.0,0.5713511175123811,0.8333333332916666,0.2
What were Accenture's total revenues and operating margins for the fourth quarter of fiscal 2023?,"Les transferències estatals van tenir un gran impacte el 2021 a causa de la despesa Covid, però el 2022, la seva reducció ha fet que els ingressos no financers tornin a dependre més del model de finançament autonòmic tradicional.","['Accenture Reports Fourth-Quarter and Strong Full-Year Fiscal 2023 Results\n-- For the fourth quarter, revenues are $16.0 billion , an increase of 4% in both U.S. dollars and \nlocal currency; GAAP operating margin is 12.0% , compared to 14.7%  in the fourth quarter of \nfiscal 2022; adjusted1 operating margin is 14.9% , an expansion of 20 basis points --\n-- For full fiscal year, revenues are $64.1 billion , an increase of 4% in U.S. dollars and 8% in'
 'diluted EPS of $11.41 to $11.76, a 6% to 9% increase; and adjusted EPS of $11.97 to $12.32, a \n3% to 6% increase --  \nNEW YORK; September 28, 2023  — Accenture (NYSE: ACN) reported financial results for the \nfourth quarter and full fiscal year ended August 31, 2023 . \nFor the fourth quarter , revenues were $16.0 billion , an increase of 4% in both U.S. dollars and \nlocal currency compared with the fourth quarter of fiscal 2022 . GAAP operating income was'
 'Accenture  expects GAAP operating margin for fiscal 2024  to be in the range of 14.8% to \n15.0%, an expansion of 110 to 130 basis points from fiscal 2023, and adjusted operating \nmargin, which excludes an estimated $450 million for business optimization costs, to be in the \nrange of 15.5% to 15.7%, an expansion of 10 to 30 basis points from fiscal 2023 .\nThe company expects both its GAAP and adjusted annual effective tax rate, which excludes the']","Les transferències estatals van tenir un gran impacte el 2021 a causa de la despesa Covid, però el 2022, la seva reducció ha fet que els ingressos no financers tornin a dependre més del model de finançament autonòmic tradicional.",0.0,0.3903497904460873,0.99999999995,0.875
"What were the new bookings for Accenture in the fourth quarter of fiscal 2023, and how did they compare to the previous year?","Accenture's total revenues for the fourth quarter of fiscal 2023 were $16.0 billion, with a GAAP operating margin of 12.0%. The adjusted operating margin was 14.9%.","['Days services outstanding, or DSOs, were 42 days at August 31, 2023 , compared with 43 days \nat August 31, 2022 . \nAccenture’s total cash balance at August 31, 2023  was $9.0 billion , compared with $7.9 billion  at \nAugust 31, 2022 .\nNew Bookings\nNew bookings for the fourth quarter of fiscal 2023  were $16.6 billion , a decrease of 10% in both \nU.S. dollars and local currency from the fourth quarter of fiscal 2023 .  \n•Consulting new bookings were $8.5 billion , or 51% of total new bookings.'
 'diluted EPS of $11.41 to $11.76, a 6% to 9% increase; and adjusted EPS of $11.97 to $12.32, a \n3% to 6% increase --  \nNEW YORK; September 28, 2023  — Accenture (NYSE: ACN) reported financial results for the \nfourth quarter and full fiscal year ended August 31, 2023 . \nFor the fourth quarter , revenues were $16.0 billion , an increase of 4% in both U.S. dollars and \nlocal currency compared with the fourth quarter of fiscal 2022 . GAAP operating income was'
 'Accenture Reports Fourth-Quarter and Strong Full-Year Fiscal 2023 Results\n-- For the fourth quarter, revenues are $16.0 billion , an increase of 4% in both U.S. dollars and \nlocal currency; GAAP operating margin is 12.0% , compared to 14.7%  in the fourth quarter of \nfiscal 2022; adjusted1 operating margin is 14.9% , an expansion of 20 basis points --\n-- For full fiscal year, revenues are $64.1 billion , an increase of 4% in U.S. dollars and 8% in']","Accenture's total revenues for the fourth quarter of fiscal 2023 were $16.0 billion, with a GAAP operating margin of 12.0%. The adjusted operating margin was 14.9%.",1.0,0.8629551141998388,0.9999999999666667,1.0
What revenue trends were observed in Accenture's key geographic markets during the fourth quarter of fiscal 2023?,"New bookings for Accenture in the fourth quarter of fiscal 2023 were $16.6 billion, a decrease of 10% compared to the previous year.","['diluted EPS of $11.41 to $11.76, a 6% to 9% increase; and adjusted EPS of $11.97 to $12.32, a \n3% to 6% increase --  \nNEW YORK; September 28, 2023  — Accenture (NYSE: ACN) reported financial results for the \nfourth quarter and full fiscal year ended August 31, 2023 . \nFor the fourth quarter , revenues were $16.0 billion , an increase of 4% in both U.S. dollars and \nlocal currency compared with the fourth quarter of fiscal 2022 . GAAP operating income was'
 'Accenture Reports Fourth-Quarter and Strong Full-Year Fiscal 2023 Results\n-- For the fourth quarter, revenues are $16.0 billion , an increase of 4% in both U.S. dollars and \nlocal currency; GAAP operating margin is 12.0% , compared to 14.7%  in the fourth quarter of \nfiscal 2022; adjusted1 operating margin is 14.9% , an expansion of 20 basis points --\n-- For full fiscal year, revenues are $64.1 billion , an increase of 4% in U.S. dollars and 8% in'
 'Accenture plc\nSummary of Revenues\n(In thousands of U.S. dollars)\n(Unaudited)\n  Three Months EndedPercent\nIncrease \n(Decrease) \nU.S.\nDollarsPercent\nIncrease \n(Decrease) \nLocal\nCurrency   August 31, 2023 August 31, 2022\nGEOGRAPHIC MARKETS\nNorth America $ 7,553,990 $ 7,523,505 —% 1%\nEurope  5,297,437  4,803,237 10 7\nGrowth Markets  3,133,773  3,096,914 1 6\nTotal Revenues $ 15,985,200 $ 15,423,656 4% 4%\nINDUSTRY GROUPS \nCommunications, Media & Technology $ 2,707,722 $ 3,081,007 (12)% (12)%']","New bookings for Accenture in the fourth quarter of fiscal 2023 were $16.6 billion, a decrease of 10% compared to the previous year.",0.5,0.8318208181440201,0.9999999999666667,0.8
"What changes occurred in NTT Data's total assets and equity between March 31, 2024, and June 30, 2024?","During the fourth quarter of fiscal 2023, revenues in North America remained flat in U.S. dollars but increased by 1% in local currency, while Europe saw a 10% increase in U.S. dollars and 7% in local currency, and Growth Markets experienced a 1% increase in U.S. dollars and 6% in local currency.","['March 31, 2024 29,604,223 10,893,059 9,844,160 33.3% 117.08 (yen)\nAnnual Dividends\nEnd of the  first quarter End of the  second quarter End of the  third quarter Year-end Total\nYear Ended  March 31, 2024 － 2.50 (yen) － 2.60 (yen) 5.10 (yen)\nYear Ending  March 31, 2025 －\nYear Ending  March 31, 2025\n(Forecasts)2.60 (yen) － 2.60 (yen) 5.20 (yen)\n(Millions of yen, except  per share amount )\nOperating Revenues Operating Profit Profit before  Taxes Profit  Attributable to  NTTBasic Earnings per Share'
 'Attributable  to NTT\nYear Ending\nMarch  31, 202513,460,000 0.6% 1,810,000 (5.9)% 1,720,000 (13.2)% 1,100,000 (14.0)% 13.00 (yen)1.  Consolidated Financial Results for the Three Months Ended June 30, 2024 (April 1, 2024 - June 30, 2024)\nAmounts are rounded  to the nearest  million yen.\nNotes:  1. Comprehensive income  (loss) attributable  to NTT:   For  the three months ended  June 30, 2024:  351,706 million  yen (41.2)%\n  For the three months  ended June 30, 2023:  597,851 million  yen 32.2%'
 'Millions of yen\nNTT Shareholders’ Equity\nNon-\ncontrolling  \ninterestsTotal equityCommon  \nstockAdditional \npaid-in  \ncapitalRetained  \nearningsTreasury \nstockOther equity  \ncomponentsTotal\nMarch 31, 2023 ¥937,950 ¥－¥8,150,117 ¥(737,290) ¥210,576 ¥8,561,353 ¥789,274 ¥9,350,627\nComprehensive  income\nProfit － － 375,775 － － 375,775 14,390 390,165\nOther comprehensive  \nincome－ － － － 222,076 222,076 44,211 266,287\nTotal  comprehensive \nincome－ － 375,775 － 222,076 597,851 58,601 656,452']","During the fourth quarter of fiscal 2023, revenues in North America remained flat in U.S. dollars but increased by 1% in local currency, while Europe saw a 10% increase in U.S. dollars and 7% in local currency, and Growth Markets experienced a 1% increase in U.S. dollars and 6% in local currency.",0.0,0.5321921746067458,0.0,0.0
"How did NTT Data's consolidated financial results for the fiscal year ending March 31, 2025, compare to the previous fiscal year?","Between March 31, 2024, and June 30, 2024, NTT Data's total assets increased from ¥29,604,223 million to ¥29,989,405 million, while total equity rose from ¥10,893,059 million to ¥11,068,578 million.","['March 31, 2024 29,604,223 10,893,059 9,844,160 33.3% 117.08 (yen)\nAnnual Dividends\nEnd of the  first quarter End of the  second quarter End of the  third quarter Year-end Total\nYear Ended  March 31, 2024 － 2.50 (yen) － 2.60 (yen) 5.10 (yen)\nYear Ending  March 31, 2025 －\nYear Ending  March 31, 2025\n(Forecasts)2.60 (yen) － 2.60 (yen) 5.20 (yen)\n(Millions of yen, except  per share amount )\nOperating Revenues Operating Profit Profit before  Taxes Profit  Attributable to  NTTBasic Earnings per Share'
 'Attributable  to NTT\nYear Ending\nMarch  31, 202513,460,000 0.6% 1,810,000 (5.9)% 1,720,000 (13.2)% 1,100,000 (14.0)% 13.00 (yen)1.  Consolidated Financial Results for the Three Months Ended June 30, 2024 (April 1, 2024 - June 30, 2024)\nAmounts are rounded  to the nearest  million yen.\nNotes:  1. Comprehensive income  (loss) attributable  to NTT:   For  the three months ended  June 30, 2024:  351,706 million  yen (41.2)%\n  For the three months  ended June 30, 2023:  597,851 million  yen 32.2%'
 'Supplemental  material  on quarterly  results :Yes\nPresentation on quarterly  results :Yes (for institutional  investors and analysts)\n(1) Consolidated Results  of Operations (Millions  of yen)\nOperating Revenues Operating Profit Profit before  Taxes Profit Attributable  to NTT\nThree months ended  June 30, 2024 3,240,023 4.1% 435,817 (8.2)% 429,392 (25.7)% 274,136 (27.0)%\nThree months ended  June 30, 2023 3,111,073 1.4% 474,650 (5.7)% 577,536 9.9% 375,775 2.0%\nBasic Earnings  per\nShare Attributable']","Between March 31, 2024, and June 30, 2024, NTT Data's total assets increased from ¥29,604,223 million to ¥29,989,405 million, while total equity rose from ¥10,893,059 million to ¥11,068,578 million.",0.0,0.792182606231601,0.0,0.0
"What were the trends in NTT Data's cash flows from operating, investing, and financing activities during the three months ended June 30, 2024?","NTT Data's consolidated financial results forecast for the fiscal year ending March 31, 2025, includes expected operating revenues of ¥13,460,000 million, a 0.6% increase, and a profit attributable to NTT of ¥1,100,000 million, a 14.0% decrease compared to the previous fiscal year.","['Attributable  to NTT\nYear Ending\nMarch  31, 202513,460,000 0.6% 1,810,000 (5.9)% 1,720,000 (13.2)% 1,100,000 (14.0)% 13.00 (yen)1.  Consolidated Financial Results for the Three Months Ended June 30, 2024 (April 1, 2024 - June 30, 2024)\nAmounts are rounded  to the nearest  million yen.\nNotes:  1. Comprehensive income  (loss) attributable  to NTT:   For  the three months ended  June 30, 2024:  351,706 million  yen (41.2)%\n  For the three months  ended June 30, 2023:  597,851 million  yen 32.2%'
 ""to NTTDiluted Earnings\nper Share\nAttributable  to NTT\nThree months ended  June 30, 2024 3.26 (yen) －(yen)\nThree months ended  June 30, 2023 4.41 (yen) －(yen)\n(2) Consolidated Financial  Position (Millions of yen, except  equity  ratio and per share amounts)\nTotal AssetsTotal  Equity\n(Net Assets)Shareholders'\nEquityEquity  Ratio\n(Ratio of Shareholders'  \nEquity to Total  Assets)Shareholders'\nEquity  per Share\nJune 30, 2024 29,989,405 11,068,578 9,968,123 33.2% 118.55 (yen)""
 'March 31, 2024 29,604,223 10,893,059 9,844,160 33.3% 117.08 (yen)\nAnnual Dividends\nEnd of the  first quarter End of the  second quarter End of the  third quarter Year-end Total\nYear Ended  March 31, 2024 － 2.50 (yen) － 2.60 (yen) 5.10 (yen)\nYear Ending  March 31, 2025 －\nYear Ending  March 31, 2025\n(Forecasts)2.60 (yen) － 2.60 (yen) 5.20 (yen)\n(Millions of yen, except  per share amount )\nOperating Revenues Operating Profit Profit before  Taxes Profit  Attributable to  NTTBasic Earnings per Share']","NTT Data's consolidated financial results forecast for the fiscal year ending March 31, 2025, includes expected operating revenues of ¥13,460,000 million, a 0.6% increase, and a profit attributable to NTT of ¥1,100,000 million, a 14.0% decrease compared to the previous fiscal year.",1.0,0.7328587556972638,0.9999999999,0.75
¿Cuáles son los principales retos estructurales que enfrenta la economía española según el informe del Banco de España?,"During the three months ended June 30, 2024, NTT Data's cash flows from operating activities decreased by ¥145,742 million compared to the previous year, while cash used in investing activities increased by ¥135,046 million, and cash provided by financing activities increased by ¥193,981 million.","['DIRECCIÓN GENERAL DE ECONOMÍA Y ESTADÍSTICA –BANCO DE ESPAÑA 2Capítulo 1\nCapítulo 2\nCapítulo 3\nCapítulo 4 Laresiliencia delaeconomía española enelcontexto europeo\nRetos estructurales delaeconomía española\nElmercado detrabajo español :situación actual, tendencias estructurales ypolíticas deempleo\nElmercado delavivienda enEspaña :evolución reciente, riesgos yproblemas deaccesibilidadINFORME ANUAL 2023 DEL BANCO DE ESPAÑA'
 'DIRECCIÓN GENERAL DE ECONOMÍA Y ESTADÍSTICA –BANCO DE ESPAÑA 11RETOS ESTRUCTURALES DE LA ECONOMÍA ESPAÑOLA\nMARCO INSTITUCIONALContexto EvidenciaÁreas en las \nque incidir•Existe unamplio consenso enlaliteratura académica enqueelmarco institucional y,más enconcreto, lacalidad delasinstituciones yel\ngrado deconfianza quegeneran enlosdistintos agentes económicos sonundeterminante fundamental delcrecimiento alargo plazo'
 'DIRECCIÓN GENERAL DE ECONOMÍA Y ESTADÍSTICA –BANCO DE ESPAÑA 6RETOS ESTRUCTURALES DE LA ECONOMÍA ESPAÑOLA\nTamaño y \ndemografía \nempresarial\nCuentas \npúblicas\nProductividadInversión en \ncapital e \ninnovaciónDesempleo \nestructural\n(Capítulo 3 IA 2023)\nEnvejecimiento \npoblacional\nCapital \nhumanoDesigualdad y \nbolsas de \nvulnerabilidad en \nlos hogaresMercado de \nvivienda\n(Capítulo 4 IA 2023)\nMarco \ninstitucionalTransición \necológica']","During the three months ended June 30, 2024, NTT Data's cash flows from operating activities decreased by ¥145,742 million compared to the previous year, while cash used in investing activities increased by ¥135,046 million, and cash provided by financing activities increased by ¥193,981 million.",0.0,0.3684383267681577,0.0,0.0
¿Cómo se ha comportado la inflación en España durante 2023 y cuáles son las perspectivas para los próximos años?,"Los principales retos estructurales que enfrenta la economía española incluyen impulsar el crecimiento de la productividad, reducir la elevada tasa de paro estructural, incrementar el tamaño empresarial, mejorar la calidad y confianza en las instituciones, reforzar la sostenibilidad de las cuentas públicas, y afrontar los desafíos del envejecimiento poblacional y la transición ecológica.","['DIRECCIÓN GENERAL DE ECONOMÍA Y ESTADÍSTICA –BANCO DE ESPAÑA 17EL PIB DE LA ECONOMÍA ESPAÑOLA AVANZÓ UN 2,5% EN EL CONJUNTO DE 2023, \nUN RITMO DE CRECIMIENTO MUY SUPERIOR AL REGISTRADO EN EL ÁREA DEL E URO \n•Elhecho dequeen2023 laeconomía española creciera significativamente más queelconjunto delaUEM responde, almenos enparte, aunacierta convergencia\nenlosniveles deactividad deambas regiones, puesto queelPIBdenuestro país había mostrado unmenor dinamismo relativo enelperíodo 2019 -2022'
 'DIRECCIÓN GENERAL DE ECONOMÍA Y ESTADÍSTICA –BANCO DE ESPAÑA 18A LO LARGO DE 2023, EL COMPORTAMIENTO DE LA \nACTIVIDAD ECONÓMICA ESPAÑOLA SORPRENDIÓ AL ALZA\n•En2023 ,latasa decrecimiento delPIBenEspaña sesitúo significativamente porencima delaanticipada aprincipios deañoporelBanco deEspaña–unavance\ndel1,6%–yporelconsenso delosanalistas\n•Entre losfactores queexplican esta sorpresa alalza,destaca elefecto arrastre positivo delasrevisiones dedatos referidos a2022 yundinamismo mayor del'
 'DIRECCIÓN GENERAL DE ECONOMÍA Y ESTADÍSTICA –BANCO DE ESPAÑASENDAS PROYECTADAS PARA EL IAPC DE \nSERVICIOS AL CIERRE DE CADA EJERCICIO \nDE PREVISIÓN (b)\n20LA INFLACIÓN SUBYACENTE CONTINÚA CON SU SENDA DE DESACELERACIÓN, SI BIEN LAS \nPRESIONES INFLACIONISTAS EN LOS SERVICIOS MUESTRAN UNA MAYOR RES ISTENCIA A LA BAJA\nFuentes :Eurostat, Instituto Nacional deEstadística, Consensus yBanco deEspaña .\n(a)Entre paréntesis figura elpeso en2023 decada componente enelIAPC sinenergía nialimentos .']","Los principales retos estructurales que enfrenta la economía española incluyen impulsar el crecimiento de la productividad, reducir la elevada tasa de paro estructural, incrementar el tamaño empresarial, mejorar la calidad y confianza en las instituciones, reforzar la sostenibilidad de las cuentas públicas, y afrontar los desafíos del envejecimiento poblacional y la transición ecológica.",0.0,0.6355059974945788,0.0,0.8
¿Cómo se describe el proceso de envejecimiento poblacional en España y cuáles son sus implicaciones económicas?,"Durante 2023, la inflación en España continuó una moderación más intensa de lo esperado, impulsada principalmente por una evolución favorable de los precios de la energía. Se prevé que la inflación siga desacelerándose gradualmente en los próximos trimestres.","['DIRECCIÓN GENERAL DE ECONOMÍA Y ESTADÍSTICA –BANCO DE ESPAÑA 30EL PROCESO DE ENVEJECIMIENTO DE LA POBLACIÓN ESPAÑOLA\n•España destaca enelcontexto internacional porpresentar unaelevada esperanza devida alnacer\uf02den2022 ,83,2años\uf02d\n•Noobstante ,laposición relativa deEspaña entérminos delaesperanza devida“enbuenasalud” esmás rezagada y,porejemplo, está pordetrás deAlemania,\nFrancia eItalia\nFuentes :Instituto Nacional deEstadística yEurostat .'
 '•Enlasúltimas décadas, laeconomía española haexperimentado una ralentización eneldinamismo delaproductividad ,que hasido\nsignificativamente más acusada quelaregistrada enotros países desarrollados\n•Entre losfactores queexplican elescaso empuje delaproductividad agregada enlaeconomía española, destacan elreducido crecimiento\ndelamisma enlasempresas activas ylaescasa aportación delacreación neta deempresas alavance delaproductividad'
 'DIRECCIÓN GENERAL DE ECONOMÍA Y ESTADÍSTICA –BANCO DE ESPAÑA 10RETOS ESTRUCTURALES DE LA ECONOMÍA ESPAÑOLA\nINVERSIÓN EN CAPITAL E INNOVACIÓNEvidenciaÁreas en las \nque incidir•Lainversión encapital físico ytecnológico yeldesarrollo deactividades innovadoras tienen elpotencial deelevar deforma significativa la\nproductividad ylacapacidad decrecimiento delaeconomía enelmedio ylargo plazo\uf0aeCualquier política integral decrecimiento sostenible\nhadeestimular este tipodeactividades']","Durante 2023, la inflación en España continuó una moderación más intensa de lo esperado, impulsada principalmente por una evolución favorable de los precios de la energía. Se prevé que la inflación siga desacelerándose gradualmente en los próximos trimestres.",0.0,0.7917498743603414,0.8333333332916666,0.8
¿Qué impacto ha tenido la volatilidad de los precios del petróleo en los resultados financieros de Repsol?,"El envejecimiento poblacional en España se caracteriza por una baja tasa de fecundidad y una alta esperanza de vida, lo que supone un desafío para el mercado laboral y las finanzas públicas debido al incremento del gasto en pensiones y sanidad. Se requieren políticas para promover la prolongación de la vida laboral y mejorar la formación continua.La volatilidad de los precios del petróleo ha afectado los ingresos de Repsol, aunque la compañía ha logrado mitigar los impactos a través de estrategias de cobertura y diversificación de sus fuentes de ingresos.","['IV. La cotización de la acción de Repsol durante el ejercicio ha experimentado una elevada volatilidad, con \nuna reducción del precio a cierre del ejercicio respecto a los niveles de inicio del año del 9%, que se han \nvisto impactadas por el descenso de los precios de los hidrocarburos (especialmente el gas natural en \nEstados Unidos; -59% el Henry Hub). Sin embargo, la cotización media del periodo ha sido un 9% \nsuperior a la de 2022.\n(3)ACTIVIDAD\tINVERSORA'
 'sus sociedades dependientes, ya que la materialización de un riesgo en los estados financieros de las filiales \npodría tener impacto en Repsol, S.A. a través de la valoración de su cartera de participaciones o de la retribución \nde las mismas mediante dividendos. Por tanto, para un adecuado análisis de riesgos, es necesario remitirse al \nInforme de Gestión Consolidado del Grupo Repsol, disponible en la web www.repsol.com, y a las Cuentas \nAnuales Consolidadas.'
 'en el análisis de la solvencia y de los hábitos de pago de cada cliente.  La Sociedad no tiene una concentración \nsignificativa de riesgo de crédito con terceros por deudas comerciales a cobrar (1,5% del total).\n5.4)\t Riesgo\tde\tprecio\tde\tcommodities\nEl riesgo de precio de commodities está asociado a la volatilidad de los precios del petróleo, productos \nderivados, gas natural y electricidad, así como de otras  commodities  propias de la actividad del Grupo Repsol. Si']","El envejecimiento poblacional en España se caracteriza por una baja tasa de fecundidad y una alta esperanza de vida, lo que supone un desafío para el mercado laboral y las finanzas públicas debido al incremento del gasto en pensiones y sanidad. Se requieren políticas para promover la prolongación de la vida laboral y mejorar la formación continua.La volatilidad de los precios del petróleo ha afectado los ingresos de Repsol, aunque la compañía ha logrado mitigar los impactos a través de estrategias de cobertura y diversificación de sus fuentes de ingresos.",0.25,0.45327464939596407,0.9999999999666667,1.0
¿Cómo ha afectado la transición energética a las estrategias y operaciones de Repsol?,"La transición energética ha llevado a Repsol a invertir significativamente en energías renovables y a reorientar sus operaciones hacia fuentes de energía más sostenibles, lo que refleja su compromiso con la reducción de emisiones de carbono.","['requerirá a las empresas una estrategia de adaptación a la transición energética que Repsol ha iniciado ya. \nAsimismo, estas hipótesis son consistentes con las consideradas para definir la estrategia de Repsol y con los \nobjetivos contemplados en la actualización estratégica publicada en febrero de 2024 (PE24-27). Hay que advertir \nque el PE 24-27 presenta algunos escenarios de precios con la finalidad de demostrar la capacidad de la'
 'restricción de uso de combustibles fósiles y el desarrollo de tecnologías alternativas, que impulsan la transición \nenergética y que supondrán una reducción de la demanda de productos de hidrocarburos a medio y largo plazo. \nEn concreto, las hipótesis consideradas por Repsol contemplan escenarios de transición energética, impulsados \npor las políticas de descarbonización, que están alineados con los objetivos del Acuerdo de París.'
 'por la dirección, elaborados en consonancia \ncon el escenario de transición energética y \ndescarbonización de la economía y los \ncompromisos de descarbonización adquiridos \npor Repsol.  \n \nEn las pruebas de deterioro, tal como se indica \nen las notas citadas, la Sociedad ha \nconsiderado previsiones sectoriales, la \nexperiencia pasada y sus expectativas futuras \nde la evolución de los negocios y del \ndesarrollo de mercado que contemplan \nescenarios de transición energética y']","La transición energética ha llevado a Repsol a invertir significativamente en energías renovables y a reorientar sus operaciones hacia fuentes de energía más sostenibles, lo que refleja su compromiso con la reducción de emisiones de carbono.",1.0,0.8236130543014631,0.9999999999666667,1.0
¿Qué medidas ha implementado Repsol para mejorar su sostenibilidad financiera y operativa?,"Repsol ha implementado medidas como la optimización de su portafolio de activos, la reducción de deuda y la inversión en tecnología para mejorar su sostenibilidad financiera y operativa a largo plazo.","['y (iv) el registro contable de operaciones societarias (ver Nota 9).\nEstas Cuentas Anuales reflejan la estrategia de Repsol para ser una compañía cero emisiones netas en 2050, \nalineada con los objetivos del Acuerdo de París y los de Desarrollo Sostenible de Naciones Unidas. En este \nsentido, Repsol ha tenido en cuenta los impactos del cambio climático y la descarbonización de la economía en \nla definición de las estimaciones y juicios contables, especialmente en la evaluación del valor recuperable de los'
 'requerirá a las empresas una estrategia de adaptación a la transición energética que Repsol ha iniciado ya. \nAsimismo, estas hipótesis son consistentes con las consideradas para definir la estrategia de Repsol y con los \nobjetivos contemplados en la actualización estratégica publicada en febrero de 2024 (PE24-27). Hay que advertir \nque el PE 24-27 presenta algunos escenarios de precios con la finalidad de demostrar la capacidad de la'
 'Repsol, S.A.  \n \n \n7 \nEn la preparación de las cuentas anuales, los administradores son responsables de la valoración de \nla capacidad de la Sociedad para continuar como  empresa  en funcionamiento, revelando, según \ncorresponda, las cuestiones relacionadas con  empresa  en funcionamiento y utilizando el principio \ncontable de  empresa  en funcionamiento excepto si los administradores tienen intención de liquidar la \nSociedad o de cesar sus operaciones, o bien no exista otra alternativa realista.']","Repsol ha implementado medidas como la optimización de su portafolio de activos, la reducción de deuda y la inversión en tecnología para mejorar su sostenibilidad financiera y operativa a largo plazo.",0.0,0.7965238832296729,0.9999999999666667,0.0
