question,answer,contexts,ground_truth,faithfulness,answer_relevancy,context_precision,context_recall
Quines són les principals causes de l'augment del PIB de Catalunya el 2022 segons l'informe financer?,"L'augment del PIB de Catalunya el 2022, que ha estat del 5,5%, s'atribueix a factors com la recuperació del consum de les llars, l'augment de la inversió en béns d'equipament i construcció, així com un fort increment de les exportacions totals, especialment impulsades pel turisme estranger.","['17\nInforme  fInancer  anual  2022III. La Generalitat de Catalunya: estructura institucional \ni competències\nIII.1. Els organismes al servei de la Generalitat de Catalunya\nOrganització basada \nen institucions \nhistòriquesEl 9 d’agost de 2006 va entrar en vigor l’actual Estatut d’autonomia de Catalunya \nque defineix les institucions polítiques catalanes, les competències i les relaci -\nons amb l’Estat. L’Estatut va ser aprovat prèviament per les Corts espanyoles, i'
 '41\nInforme  fInancer  anual  2022VI. Anàlisi financera i política d’endeutament\nIncrement del deute \nviu i minoració de \nl’import avalatEl volum de deute viu de la Generalitat de Catalunya en el tancament de 2022 es \nsitua en 79.135\xa0M€, dels quals 78.662\xa0M€ corresponen a deute a llarg termini. \nL’augment del deute de la Generalitat de Catalunya és causat, en part, pel dèficit \npúblic i, en part, per l’absorció del deute de les empreses del sector públic, tant a'
 '9\nInforme  fInancer  anual  2022L’any 2022, el PIB de Catalunya ha assolit els 270.710 milions d’euros i el crei -\nxement en volum ha estat d’un 5,5\xa0%. Des de l’òptica de la demanda, cal re -\nmarcar l’augment del consum de les llars (4,1\xa0%, tot i que és un punt i quatre \ndècimes inferior al de l’any anterior) i de la formació bruta de capital (3,8\xa0%). Per \ncomponents, la inversió en béns d’equipament creix un 3,5\xa0% i la inversió en']","L'augment del PIB de Catalunya el 2022, que ha estat del 5,5%, s'atribueix a factors com la recuperació del consum de les llars, l'augment de la inversió en béns d'equipament i construcció, així com un fort increment de les exportacions totals, especialment impulsades pel turisme estranger.",0.5,0.4620899456883219,0.3333333333,0.3333333333333333
Quins sectors econòmics han tingut una evolució més positiva i quins han patit més durant el 2022?,"Els sectors que han tingut una evolució més positiva són els serveis, especialment el comerç, transport i hostaleria, amb un creixement del 7,9%. En canvi, la indústria ha patit una contracció del 2,0%, i el sector agrari ha experimentat una caiguda del 13,9%.","['2022, que representa una millora respecte a la dada del període anterior (3\xa0%). \nEl consum de ciment va registrar un increment notable, del 6,8\xa0%, No obstant \naixò, els visats de nova construcció han disminuït un 10,5\xa0% anual. Per la seva \nbanda, les xifres de compravendes d’habitatge nou i usat han continuat creixent \nsignificativament i, en termes acumulats, augmenten un 14,5\xa0%, impulsades \nper l’expectativa d’alces futures en els tipus d’interès. Pel que fa als preus de'
 'L’economia catalana ha resistit els xocs geopolític i inflacionari sense entrar en \nrecessió i tanca l’any millor del que s’esperava. El patró de creixement de l’eco -\nnomia catalana ha anat de més a menys durant el 2022. L’evolució del PIB s’ha \nalentit el 4t trimestre fins al 0,2 % intertrimestral i el 2,7 % interanual, a causa de \nla inflació (que, tot i moderar-se, continua sent elevada), les fortes pujades dels \ntipus d’interès i la crisi energètica i de subministraments.'
 'previsiones económicas que puedan influir en la evolución de la demanda. Las conclusiones obtenidas se \ncomparan con previsiones externas que la Compañía obtiene de agencias especializadas. \n– Respecto de los escenarios de evolución de la demanda del transporte terrestre previstos en la estimación \nde los flujos de caja de los negocios industriales y comerciales de Repsol, se mantiene un escenario \ncoherente con el paquete de medidas anunciadas por la Comisión Europea denominado “Fit for 55” y la']","Els sectors que han tingut una evolució més positiva són els serveis, especialment el comerç, transport i hostaleria, amb un creixement del 7,9%. En canvi, la indústria ha patit una contracció del 2,0%, i el sector agrari ha experimentat una caiguda del 13,9%.",0.0,0.47229931126662517,0.99999999995,1.0
Quina és la importància del turisme estranger per a l'economia catalana segons l'informe?Com es distribueixen les competències entre l'Estat i la Generalitat de Catalunya segons l'informe financer?,"El turisme estranger ha estat crucial per a l'economia catalana el 2022, amb un total de 14,9 milions de turistes i una despesa de 16.479 milions d'euros, representant el 20,7% del total de turistes estrangers a Espanya.","['19\nInforme  fInancer  anual  2022Presència elevada \nen la vida de la \nciutadaniaEl nombre i la rellevància de les competències que assumeix la Generalitat de \nCatalunya li proporcionen una presència constant en la societat i en l’economia \ncatalanes. Només cal dir, com a mostra, que el pressupost liquidat de despeses \nno financeres més despeses en actius financers del sector públic administratiu \nconsolidat de la Generalitat de Catalunya, per a l’any 2022, representa el 14,2\xa0%'
 '41\nInforme  fInancer  anual  2022VI. Anàlisi financera i política d’endeutament\nIncrement del deute \nviu i minoració de \nl’import avalatEl volum de deute viu de la Generalitat de Catalunya en el tancament de 2022 es \nsitua en 79.135\xa0M€, dels quals 78.662\xa0M€ corresponen a deute a llarg termini. \nL’augment del deute de la Generalitat de Catalunya és causat, en part, pel dèficit \npúblic i, en part, per l’absorció del deute de les empreses del sector públic, tant a'
 '17\nInforme  fInancer  anual  2022III. La Generalitat de Catalunya: estructura institucional \ni competències\nIII.1. Els organismes al servei de la Generalitat de Catalunya\nOrganització basada \nen institucions \nhistòriquesEl 9 d’agost de 2006 va entrar en vigor l’actual Estatut d’autonomia de Catalunya \nque defineix les institucions polítiques catalanes, les competències i les relaci -\nons amb l’Estat. L’Estatut va ser aprovat prèviament per les Corts espanyoles, i']","El turisme estranger ha estat crucial per a l'economia catalana el 2022, amb un total de 14,9 milions de turistes i una despesa de 16.479 milions d'euros, representant el 20,7% del total de turistes estrangers a Espanya.",0.0,0.48639114499453723,0.0,0.3333333333333333
Com afecta la capacitat fiscal a la distribució de recursos entre comunitats autònomes?,"Les competències es distribueixen en competències exclusives, compartides i executives, amb la Generalitat exercint un alt nivell d'autonomia en àrees com l'agricultura, cultura, dret civil, i ordenació territorial, entre altres.","['sos de les comunitats autònomes depenen en gran mesura de la precisió amb \nquè aquestes previsions s’acabin ajustant als ingressos definitius, és a dir, que \nl’import distribuït a les comunitats autònomes està subjecte a errors de previsió \nper part del govern de l’Estat. Les comunitats reben els ingressos en funció \nd’aquesta previsió i no en funció de l’evolució de la recaptació. La ineficiència \nd’aquest sistema es va evidenciar en les liquidacions dels anys 2008 i 2009, en'
 'cooperació:\n• El fons de competitivitat està destinat a les comunitats autònomes que \ntenen un finançament per càpita inferior a la mitjana o inferior al seu índex \nde capacitat fiscal. Té com a objectiu reduir les diferències en els recursos \nper càpita i incentivar l’autonomia i la capacitat fiscal. Aquest fons es dis -\ntribueix entre les comunitats autònomes beneficiàries –entre les quals es \ntroba Catalunya– segons la seva població ajustada relativa.'
 'tres àmbits: el normatiu, en el dels rendiments i en el de la gestió tributària. \nAquesta autonomia financera no pot suposar l’existència de barreres a la \ncirculació de béns i factors al llarg del territori espanyol.\n• Solidaritat . El sistema persegueix la correcció dels desequilibris territorials \nmitjançant la distribució de recursos entre comunitats autònomes.\n• Suficiència . La Llei orgànica de finançament de les comunitats autònomes']","Les competències es distribueixen en competències exclusives, compartides i executives, amb la Generalitat exercint un alt nivell d'autonomia en àrees com l'agricultura, cultura, dret civil, i ordenació territorial, entre altres.",0.0,0.41760878393432543,0.9999999999666667,0.5
Quin impacte han tingut les transferències estatals en els ingressos no financers de la Generalitat de Catalunya el 2022?,"La capacitat fiscal determina que les comunitats autònomes amb menor capacitat rebin transferències positives per equilibrar els recursos necessaris per finançar els serveis públics fonamentals, mentre que aquelles amb major capacitat han de fer aportacions a les altres comunitats.","['1 Sense considerar les transferències que fa l’Estat per al finançament dels ens locals de Catalunya, \natès que la Generalitat només actua com a caixa pagadora.'
 'tària.Autonomia financera Els ingressos de la Generalitat són majoritàriament de caràcter impositiu i és \nespecialment destacable la contribució de l’IRPF i de l’IVA, amb un pes conjunt \nsobre els ingressos no financers d’un 58,7\xa0% l’any 2022.\nL’any 2022 el pes dels ingressos impositius, que inclou tant els tributs cedits \ncom els impostos propis, sobre els recursos no financers totals és del 82,6\xa0%, \nun percentatge superior al de l’any anterior (76,1\xa0%), degut a les transferències'
 '19\nInforme  fInancer  anual  2022Presència elevada \nen la vida de la \nciutadaniaEl nombre i la rellevància de les competències que assumeix la Generalitat de \nCatalunya li proporcionen una presència constant en la societat i en l’economia \ncatalanes. Només cal dir, com a mostra, que el pressupost liquidat de despeses \nno financeres més despeses en actius financers del sector públic administratiu \nconsolidat de la Generalitat de Catalunya, per a l’any 2022, representa el 14,2\xa0%']","La capacitat fiscal determina que les comunitats autònomes amb menor capacitat rebin transferències positives per equilibrar els recursos necessaris per finançar els serveis públics fonamentals, mentre que aquelles amb major capacitat han de fer aportacions a les altres comunitats.",0.0,0.4442430631241539,0.49999999995,0.5
What were Accenture's total revenues and operating margins for the fourth quarter of fiscal 2023?,"Les transferències estatals van tenir un gran impacte el 2021 a causa de la despesa Covid, però el 2022, la seva reducció ha fet que els ingressos no financers tornin a dependre més del model de finançament autonòmic tradicional.","['Accenture Reports Fourth-Quarter and Strong Full-Year Fiscal 2023 Results\n-- For the fourth quarter, revenues are $16.0 billion , an increase of 4% in both U.S. dollars and \nlocal currency; GAAP operating margin is 12.0% , compared to 14.7%  in the fourth quarter of \nfiscal 2022; adjusted1 operating margin is 14.9% , an expansion of 20 basis points --\n-- For full fiscal year, revenues are $64.1 billion , an increase of 4% in U.S. dollars and 8% in'
 'the last six months position us at the heart of the beginning of AI-fueled reinvention.  I would like \nto thank our extraordinary 733,000  people who made these results possible and focus every day \non creating 360° value for all of our stakeholders.”\nFinancial Review\n \nFourth Quarter Fiscal 2023\nRevenues for the fourth quarter of fiscal 2023  were $15.99 billion , compared with $15.42 billion  \nfor the fourth quarter of fiscal 2022 , an increase of 4% in both U.S. dollars and local currency,'
 '3.  Consolidated  Financial  Results Forecasts for the Fiscal Year  Ending  March  31, 2025 (April 1, 2024 - March 31, 2025)\nNotes: 1. Percentages  above represent  changes from the previous fiscal  year.\n\u3000\u3000\u30002. Revision to the  consolidated  financial  results forecasts from the latest  announcement:  None- 1 -']","Les transferències estatals van tenir un gran impacte el 2021 a causa de la despesa Covid, però el 2022, la seva reducció ha fet que els ingressos no financers tornin a dependre més del model de finançament autonòmic tradicional.",0.0,0.5226722529778347,0.9999999999,0.6666666666666666
"What were the new bookings for Accenture in the fourth quarter of fiscal 2023, and how did they compare to the previous year?","Accenture's total revenues for the fourth quarter of fiscal 2023 were $16.0 billion, with a GAAP operating margin of 12.0%. The adjusted operating margin was 14.9%.","['Days services outstanding, or DSOs, were 42 days at August 31, 2023 , compared with 43 days \nat August 31, 2022 . \nAccenture’s total cash balance at August 31, 2023  was $9.0 billion , compared with $7.9 billion  at \nAugust 31, 2022 .\nNew Bookings\nNew bookings for the fourth quarter of fiscal 2023  were $16.6 billion , a decrease of 10% in both \nU.S. dollars and local currency from the fourth quarter of fiscal 2023 .  \n•Consulting new bookings were $8.5 billion , or 51% of total new bookings.'
 'equipment additions were $718 million , and free cash flow was $8.82 billion .\nNew Bookings\nNew bookings for fiscal 2023  were $72.2 billion , an increase of 1% in U.S. dollars and 5% in \nlocal currency from fiscal 2022 .  \n•Consulting new bookings were $36.2 billion , or 50% of total new bookings. \n•Managed Services new bookings were $36.0 billion , or 50% of total new bookings. \nRevenues by Geographic Market\nRevenues by geographic market for fiscal 2023  were as follows:'
 'Julie Sweet, chair and CEO, Accenture, said, “I am extremely proud that we have achieved \nanother strong year of financial performance in fiscal year 2023. Our ability to remain laser-\nfocused on meeting the needs of our clients is reflected in new bookings of $72 billion  in fiscal \n2023; 106 clients with quarterly bookings of more than $100 million; and reaching a record 300 \nDiamond clients, our largest relationships. Our clients’ generative AI bookings of $300 million in']","Accenture's total revenues for the fourth quarter of fiscal 2023 were $16.0 billion, with a GAAP operating margin of 12.0%. The adjusted operating margin was 14.9%.",0.3333333333333333,0.8239682076598469,0.9999999999,0.2857142857142857
What revenue trends were observed in Accenture's key geographic markets during the fourth quarter of fiscal 2023?,"New bookings for Accenture in the fourth quarter of fiscal 2023 were $16.6 billion, a decrease of 10% compared to the previous year.","['the last six months position us at the heart of the beginning of AI-fueled reinvention.  I would like \nto thank our extraordinary 733,000  people who made these results possible and focus every day \non creating 360° value for all of our stakeholders.”\nFinancial Review\n \nFourth Quarter Fiscal 2023\nRevenues for the fourth quarter of fiscal 2023  were $15.99 billion , compared with $15.42 billion  \nfor the fourth quarter of fiscal 2022 , an increase of 4% in both U.S. dollars and local currency,'
 'Accenture Reports Fourth-Quarter and Strong Full-Year Fiscal 2023 Results\n-- For the fourth quarter, revenues are $16.0 billion , an increase of 4% in both U.S. dollars and \nlocal currency; GAAP operating margin is 12.0% , compared to 14.7%  in the fourth quarter of \nfiscal 2022; adjusted1 operating margin is 14.9% , an expansion of 20 basis points --\n-- For full fiscal year, revenues are $64.1 billion , an increase of 4% in U.S. dollars and 8% in'
 'Accenture plc\nSummary of Revenues\n(In thousands of U.S. dollars)\n(Unaudited)\n  Three Months EndedPercent\nIncrease \n(Decrease) \nU.S.\nDollarsPercent\nIncrease \n(Decrease) \nLocal\nCurrency   August 31, 2023 August 31, 2022\nGEOGRAPHIC MARKETS\nNorth America $ 7,553,990 $ 7,523,505 —% 1%\nEurope  5,297,437  4,803,237 10 7\nGrowth Markets  3,133,773  3,096,914 1 6\nTotal Revenues $ 15,985,200 $ 15,423,656 4% 4%\nINDUSTRY GROUPS \nCommunications, Media & Technology $ 2,707,722 $ 3,081,007 (12)% (12)%']","New bookings for Accenture in the fourth quarter of fiscal 2023 were $16.6 billion, a decrease of 10% compared to the previous year.",0.0,0.7660325101190294,0.5833333333041666,0.5
"What changes occurred in NTT Data's total assets and equity between March 31, 2024, and June 30, 2024?","During the fourth quarter of fiscal 2023, revenues in North America remained flat in U.S. dollars but increased by 1% in local currency, while Europe saw a 10% increase in U.S. dollars and 7% in local currency, and Growth Markets experienced a 1% increase in U.S. dollars and 6% in local currency.","['June 30, 2024 : 90,550,316,400 shares\nMarch 31, 2024 : 90,550,316,400 shares\nJune 30, 2024 :   6,467,282,494 shares\nMarch 31, 2024 :   6,468,768,847 shares\nFor the three  months ended June 30, 2024 : 84,081,781,237 shares\nFor the three  months ended June 30, 2023 : 85,235,489,679 shares*Notes:\n(1)    Significant  changes in  the scope of consolidation  during the three  months ended June 30, 2024:  None\n(2)    Change  of accounting policy  and accounting  estimates'
 '(1)  Significant  changes  in the scope of consolidation during the three  months  ended June 30, 2024: None\n(2)  Changes in Accounting Policies  and Estimates: None- 3 -'
 '2. Percentages  above represent  changes from the  corresponding period of previous fiscal  year.\nNote:  NTT conducted  a 25-for-1 stock split of its common  stock, with an effective  date  of July 1, 2023. The figures for Basic Earnings  per Share Attributable  to NTT have  been adjusted to  reflect\n\u3000\u3000  the impact  of the stock split as if  the stock split had  occurred at the  beginning of the prior  fiscal year.']","During the fourth quarter of fiscal 2023, revenues in North America remained flat in U.S. dollars but increased by 1% in local currency, while Europe saw a 10% increase in U.S. dollars and 7% in local currency, and Growth Markets experienced a 1% increase in U.S. dollars and 6% in local currency.",0.75,0.5844645615317422,0.0,0.3333333333333333
"How did NTT Data's consolidated financial results for the fiscal year ending March 31, 2025, compare to the previous fiscal year?","Between March 31, 2024, and June 30, 2024, NTT Data's total assets increased from ¥29,604,223 million to ¥29,989,405 million, while total equity rose from ¥10,893,059 million to ¥11,068,578 million.","['3.  Consolidated  Financial  Results Forecasts for the Fiscal Year  Ending  March  31, 2025 (April 1, 2024 - March 31, 2025)\nNotes: 1. Percentages  above represent  changes from the previous fiscal  year.\n\u3000\u3000\u30002. Revision to the  consolidated  financial  results forecasts from the latest  announcement:  None- 1 -'
 '(1) The  last days of the fiscal  year ended March 31, 2024 and  three months ended June 30, 2024 fell  on non-business days, resulting\n\u3000  in the  due date of certain  bills, including  telecommunication  service  bills, being set to  the first business day of the following  month.\n      Consequently,  the impact  on the condensed quarterly  consolidated  financial  statements  is as follows.'
 'Attributable  to NTT\nYear Ending\nMarch  31, 202513,460,000 0.6% 1,810,000 (5.9)% 1,720,000 (13.2)% 1,100,000 (14.0)% 13.00 (yen)1.  Consolidated Financial Results for the Three Months Ended June 30, 2024 (April 1, 2024 - June 30, 2024)\nAmounts are rounded  to the nearest  million yen.\nNotes:  1. Comprehensive income  (loss) attributable  to NTT:   For  the three months ended  June 30, 2024:  351,706 million  yen (41.2)%\n  For the three months  ended June 30, 2023:  597,851 million  yen 32.2%']","Between March 31, 2024, and June 30, 2024, NTT Data's total assets increased from ¥29,604,223 million to ¥29,989,405 million, while total equity rose from ¥10,893,059 million to ¥11,068,578 million.",0.0,0.7284737341541382,0.9999999999,0.0
"What were the trends in NTT Data's cash flows from operating, investing, and financing activities during the three months ended June 30, 2024?","NTT Data's consolidated financial results forecast for the fiscal year ending March 31, 2025, includes expected operating revenues of ¥13,460,000 million, a 0.6% increase, and a profit attributable to NTT of ¥1,100,000 million, a 14.0% decrease compared to the previous fiscal year.","['subsidiaries, ” which had previously been  presented within “Other,  net” in cash  flows  from  investing activities  for the three  months\n       ended  June 30, 2023, are now presented separately  for the three  months ended June 30, 2024 due to an  increase in the  materiality\n       of the  amount of such items.  As a result  of this change, the  ¥17,312 million amount  that had  previously been presented  as “Other,'
 'net ” in the consolidated  statement  of cash flows for the three  months ended June 30, 2023 has been reclassified  and presented  as\n       ¥20,878 million  of “Proceeds from  sale of property, plant  and equipment,  intangible  assets and investment  property,” ¥167 million\n       of “Proceeds  from acquisition  of subsidiaries” and ¥(3,733) million  of “Other, net.- 11 -'
 'Cash and cash equivalents  at the  beginning of the year  (1)793,920 982,874 188,954\nCash and cash  equivalents at  the end of the  period (1)¥ 1,017,909 ¥ 1,114,248 ¥ 96,339\nThree  Months Ended\nJune 30, 2023Three  Months Ended\n June 30, 2024\n(Condensed Quarterly  Consolidated Statement  of Cash Flows)\nDecrease  (increase) in trade  and other receivables － (18,501)\nCash and cash  equivalents as of April 1 － (192,820)\nCash and cash  equivalents as of June 30 － (211,321)Notes:']","NTT Data's consolidated financial results forecast for the fiscal year ending March 31, 2025, includes expected operating revenues of ¥13,460,000 million, a 0.6% increase, and a profit attributable to NTT of ¥1,100,000 million, a 14.0% decrease compared to the previous fiscal year.",0.0,0.7324362368069165,0.0,0.0
¿Cuáles son los principales retos estructurales que enfrenta la economía española según el informe del Banco de España?,"During the three months ended June 30, 2024, NTT Data's cash flows from operating activities decreased by ¥145,742 million compared to the previous year, while cash used in investing activities increased by ¥135,046 million, and cash provided by financing activities increased by ¥193,981 million.","['DIRECCIÓN GENERAL DE ECONOMÍA Y ESTADÍSTICA –BANCO DE ESPAÑA 8RETOS ESTRUCTURALES DE LA ECONOMÍA ESPAÑOLA\nTAMAÑO Y DEMOGRAFÍA EMPRESARIALEvidenciaÁreas en las \nque incidir•Todos aquellos aspectos quelimitan artificialmente elcrecimiento empresarial olacapacidad para quelosfactores productivos sereasignen\nentre sectores yempresas acaban redundando, eventualmente, enunmenor dinamismo delaproductividad delaeconomía'
 'DIRECCIÓN GENERAL DE ECONOMÍA Y ESTADÍSTICA –BANCO DE ESPAÑA 7RETOS ESTRUCTURALES DE LA ECONOMÍA ESPAÑOLA\nPRODUCTIVIDADEvidenciaÁreas en las \nque incidir•Losavances enlaProductividad Total delosFactores (PTF) pueden considerarse como eldeterminante fundamental delcrecimiento alargo\nplazo ,enlamedida enquelasmejoras enlaeficiencia alutilizar losrecursos productivos noestán sometidas arendimientos decrecientes y,\nademás, suusonoesexcluyente'
 'DIRECCIÓN GENERAL DE ECONOMÍA Y ESTADÍSTICA –BANCO DE ESPAÑAGRACIAS POR SU ATENCIÓN']","During the three months ended June 30, 2024, NTT Data's cash flows from operating activities decreased by ¥145,742 million compared to the previous year, while cash used in investing activities increased by ¥135,046 million, and cash provided by financing activities increased by ¥193,981 million.",0.0,0.26268099643189946,0.0,1.0
¿Cómo se ha comportado la inflación en España durante 2023 y cuáles son las perspectivas para los próximos años?,"Los principales retos estructurales que enfrenta la economía española incluyen impulsar el crecimiento de la productividad, reducir la elevada tasa de paro estructural, incrementar el tamaño empresarial, mejorar la calidad y confianza en las instituciones, reforzar la sostenibilidad de las cuentas públicas, y afrontar los desafíos del envejecimiento poblacional y la transición ecológica.","['I. Durante 2023, la economía global se ha mostrado relativamente resiliente pero ha sufrido una elevada \nincertidumbre. El contexto internacional ha venido marcado por las decisiones de política monetaria \npara hacer frente a la inflación y por la evolución de un convulso escenario geopolítico. Los precios \ninternacionales de referencia para buena parte de los productos energéticos se han reducido de'
 'DIRECCIÓN GENERAL DE ECONOMÍA Y ESTADÍSTICA –BANCO DE ESPAÑA 19EN 2023, CONTINUÓ LA MODERACIÓN DE LAS TASAS DE INFLACIÓN \nGENERAL , UN PROCESO QUE FUE MÁS INTENSO DE LO ESPERADO \nFuentes :Eurostat, Instituto Nacional deEstadística, Consensus yBanco deEspaña .\n(a)Laslíneas punteadas representan elmáximo yelmínimo entre lasinstituciones queforman parte delpanel deConsensus .'
 'iguales, en los diez períodos impositivos que se inicien a partir del 1 de enero de 2024. Como consecuencia de \nello, la Sociedad ha registrado un activo por impuesto diferido por importe de 76 millones de euros.\nLas diferencias temporarias imponibles por inversiones en dependientes, asociadas y negocios conjuntos no \nregistradas en balance por cumplir los requisitos establecidos para acogerse a la excepción de registro vigente']","Los principales retos estructurales que enfrenta la economía española incluyen impulsar el crecimiento de la productividad, reducir la elevada tasa de paro estructural, incrementar el tamaño empresarial, mejorar la calidad y confianza en las instituciones, reforzar la sostenibilidad de las cuentas públicas, y afrontar los desafíos del envejecimiento poblacional y la transición ecológica.",0.0,0.3199260382162545,0.49999999995,0.0
¿Cómo se describe el proceso de envejecimiento poblacional en España y cuáles son sus implicaciones económicas?,"Durante 2023, la inflación en España continuó una moderación más intensa de lo esperado, impulsada principalmente por una evolución favorable de los precios de la energía. Se prevé que la inflación siga desacelerándose gradualmente en los próximos trimestres.","['DIRECCIÓN GENERAL DE ECONOMÍA Y ESTADÍSTICA –BANCO DE ESPAÑA 8RETOS ESTRUCTURALES DE LA ECONOMÍA ESPAÑOLA\nTAMAÑO Y DEMOGRAFÍA EMPRESARIALEvidenciaÁreas en las \nque incidir•Todos aquellos aspectos quelimitan artificialmente elcrecimiento empresarial olacapacidad para quelosfactores productivos sereasignen\nentre sectores yempresas acaban redundando, eventualmente, enunmenor dinamismo delaproductividad delaeconomía'
 'DIRECCIÓN GENERAL DE ECONOMÍA Y ESTADÍSTICA –BANCO DE ESPAÑAGRACIAS POR SU ATENCIÓN'
 'DIRECCIÓN GENERAL DE ECONOMÍA Y ESTADÍSTICA –BANCO DE ESPAÑA1.Mensajes principales\n2.Dinámicas recientes de la actividad económica en España\n3.Retos estructurales de la economía españolaÍNDICE DE ESTA PRESENTACIÓN\n3']","Durante 2023, la inflación en España continuó una moderación más intensa de lo esperado, impulsada principalmente por una evolución favorable de los precios de la energía. Se prevé que la inflación siga desacelerándose gradualmente en los próximos trimestres.",0.0,0.6472770663228612,0.9999999999,0.0
¿Qué impacto ha tenido la volatilidad de los precios del petróleo en los resultados financieros de Repsol?,"El envejecimiento poblacional en España se caracteriza por una baja tasa de fecundidad y una alta esperanza de vida, lo que supone un desafío para el mercado laboral y las finanzas públicas debido al incremento del gasto en pensiones y sanidad. Se requieren políticas para promover la prolongación de la vida laboral y mejorar la formación continua.La volatilidad de los precios del petróleo ha afectado los ingresos de Repsol, aunque la compañía ha logrado mitigar los impactos a través de estrategias de cobertura y diversificación de sus fuentes de ingresos.","['de sus bonos emitidos pendientes de vencimiento con un importe nominal de 412 millones de dólares y, por \ntanto, las garantías que Repsol, S.A. había otorgado a los tenedores de esos bonos también fueron canceladas.\n(13)INSTRUMENTOS\tFINANCIEROS\tDERIVADOS\nHasta principios del 2023, Repsol mantuvo contratados derivados sobre sus propias acciones que se registran a \nvalor razonable con cambios en el epígrafe “Variación a valor razonable de instrumentos financieros” de la'
 'sus sociedades dependientes, ya que la materialización de un riesgo en los estados financieros de las filiales \npodría tener impacto en Repsol, S.A. a través de la valoración de su cartera de participaciones o de la retribución \nde las mismas mediante dividendos. Por tanto, para un adecuado análisis de riesgos, es necesario remitirse al \nInforme de Gestión Consolidado del Grupo Repsol, disponible en la web www.repsol.com, y a las Cuentas \nAnuales Consolidadas.'
 'anterior. Incluso en este entorno de caída de precios de la energía y moderación de la demanda, Repsol \nha obtenido unos sólidos resultados, aunque inferiores a los del año anterior. El resultado Total del \nGrupo atribuido a la sociedad dominante (Repsol S.A.) ha sido de 3.168 millones de euros un 25% \ninferior al de 2022 (4.251 millones de euros).\nII. Por su parte, el resultado del ejercicio 2023 de Repsol, S.A. ha sido de 1.594 millones de euros,']","El envejecimiento poblacional en España se caracteriza por una baja tasa de fecundidad y una alta esperanza de vida, lo que supone un desafío para el mercado laboral y las finanzas públicas debido al incremento del gasto en pensiones y sanidad. Se requieren políticas para promover la prolongación de la vida laboral y mejorar la formación continua.La volatilidad de los precios del petróleo ha afectado los ingresos de Repsol, aunque la compañía ha logrado mitigar los impactos a través de estrategias de cobertura y diversificación de sus fuentes de ingresos.",0.25,0.40996030298803837,0.9999999999666667,1.0
¿Cómo ha afectado la transición energética a las estrategias y operaciones de Repsol?,"La transición energética ha llevado a Repsol a invertir significativamente en energías renovables y a reorientar sus operaciones hacia fuentes de energía más sostenibles, lo que refleja su compromiso con la reducción de emisiones de carbono.","['requerirá a las empresas una estrategia de adaptación a la transición energética que Repsol ha iniciado ya. \nAsimismo, estas hipótesis son consistentes con las consideradas para definir la estrategia de Repsol y con los \nobjetivos contemplados en la actualización estratégica publicada en febrero de 2024 (PE24-27). Hay que advertir \nque el PE 24-27 presenta algunos escenarios de precios con la finalidad de demostrar la capacidad de la'
 'y (iv) el registro contable de operaciones societarias (ver Nota 9).\nEstas Cuentas Anuales reflejan la estrategia de Repsol para ser una compañía cero emisiones netas en 2050, \nalineada con los objetivos del Acuerdo de París y los de Desarrollo Sostenible de Naciones Unidas. En este \nsentido, Repsol ha tenido en cuenta los impactos del cambio climático y la descarbonización de la economía en \nla definición de las estimaciones y juicios contables, especialmente en la evaluación del valor recuperable de los'
 'Repsol, S.A.  \n \n \n3 \nCuestiones clave  de la auditoría  Modo en el que se han tratado en la auditoría  \nPor otro lado, en relación con los negocios \nindustriales y comerciales se mantiene un \nescenario coherente con el paquete de \nmedidas anunciadas por la Comisión Europea \ndenominado “ Fit for 55 ” y la nueva hoja de ruta \npara la descarbonización Repower EU  que \naceleran la transición energética en Europa y \nprevén importantes descensos en la demanda \nde combustibles, principalmente a partir de \n2030.']","La transición energética ha llevado a Repsol a invertir significativamente en energías renovables y a reorientar sus operaciones hacia fuentes de energía más sostenibles, lo que refleja su compromiso con la reducción de emisiones de carbono.",1.0,0.39191568525977266,0.9999999999666667,1.0
¿Qué medidas ha implementado Repsol para mejorar su sostenibilidad financiera y operativa?,"Repsol ha implementado medidas como la optimización de su portafolio de activos, la reducción de deuda y la inversión en tecnología para mejorar su sostenibilidad financiera y operativa a largo plazo.","['enmarcó en el contexto del reforzamiento de la estructura patrimonial de Repsol Financial Trading S.à.r.l. para \nfacilitar un mejor desempeño de sus actividades. La aportación fue íntegramente financiada por Repsol, S.A. con \nlos recursos obtenidos tras la desinversión del 25% del segmento E&P y la propia generación de caja del Grupo. \nEjercicio\t2022\nEn el ejercicio 2022 se realizaron una serie de operaciones societarias, principalmente orientadas a facilitar la'
 'En la Nota 12 de la memoria de las Cuentas Anuales individuales de Repsol S.A. se describen más detalladamente \nlas distintas operaciones de financiación efectuadas por la Sociedad.\n(5)OPERACIONES\tCON\tACCIONES\tPROPIAS\nSe han ejecutado dos reducciones de capital en junio y diciembre, mediante la amortización de 50 millones de \nacciones propias y 60 millones de acciones, respectivamente (un total de 110 millones de acciones amortizadas),'
 'DIRECCIÓN GENERAL DE ECONOMÍA Y ESTADÍSTICA –BANCO DE ESPAÑAESCENARIO CON CONSOLIDACIÓN FISCAL (b)\n43ES NECESARIO DE IMPLEMENTAR, SIN DEMORA, UN PLAN DE CONSOLIDACIÓN PRESUPUESTARIA \nDE MEDIO PLAZO QUE REFUERCE LA SOSTENIBILIDAD DE LAS FINANZAS PÚBLI CAS\n•Deacuerdo conlasherramientas analíticas desarrolladas porelBanco deEspaña, enunescenario inercial\uf02dsincambios enlaspolíticas económicas yfiscales']","Repsol ha implementado medidas como la optimización de su portafolio de activos, la reducción de deuda y la inversión en tecnología para mejorar su sostenibilidad financiera y operativa a largo plazo.",0.0,0.4882453289835765,0.9999999999,0.0
